name,image_url,price
Jaket Outdoor The North Face TNF Jaket Gunung Waterproof Windbreake,https://images.tokopedia.net/img/cache/200-square/VqbcmM/2021/4/19/e083cc4c-b24b-4257-9160-0830fad84d9c.jpg,100000.0
Herv Flandin Sports Jacket North Carolina,https://images.tokopedia.net/img/cache/200-square/VqbcmM/2022/9/2/e0e0dad8-bc99-43e0-8bd7-256deb616a12.jpg,509000.0
THE NORTH FACE PUFFER JAKET,https://images.tokopedia.net/img/cache/200-square/hDjmkQ/2022/9/14/f2315559-15e8-454d-b190-8a02a2be385d.jpg,352000.0
JAKET TNF(THE NORTH FACE)/WATERPROOF ANTI AIR/SWEATER PRIA WANITA,https://images.tokopedia.net/img/cache/200-square/hDjmkQ/2022/10/16/37f9119c-8f04-4672-bda3-d4edbe59258d.jpg,235000.0
(T)erpopule(R) Jaket puffer tnf / the north face,https://images.tokopedia.net/img/cache/200-square/hDjmkQ/2022/9/26/1614039c-f5fa-43dc-9d67-a31a14a1f7a5.jpg,376000.0
north face puffer case casing iphone x 11 12 13 pro max winter jacket,https://images.tokopedia.net/img/cache/200-square/VqbcmM/2022/7/23/680b9c76-28f9-4fff-a2e6-cc57074bb434.jpg,89000.0
case the north face jacket iphone 14 14 pro max jacket,https://images.tokopedia.net/img/cache/200-square/VqbcmM/2022/9/29/31f16c9b-2d08-49af-abcb-3a749a2d7b34.jpg,119000.0
Jaket Taslan Cagoule Tnf The North Face Fanorak Black High Quality,https://images.tokopedia.net/img/cache/200-square/hDjmkQ/2022/9/21/e23ded12-161d-4648-acaa-b93cfa2bfc49.jpg,292000.0
case NORTH FACE JACKET iphone 11 12 13 pro max promax 12pro 13pro,https://images.tokopedia.net/img/cache/200-square/VqbcmM/2022/4/23/290c670b-cd02-4e37-92a9-463c6c5d1585.jpg,115000.0
SPECIAL OFFER PROMO JAKET COWOK THE NORTH FACE PREMIUM ORIGINAL DISTRO,https://images.tokopedia.net/img/cache/200-square/VqbcmM/2021/8/26/79cf3aa2-1397-47ba-90f2-e20fdf24f2a1.jpg,145000.0
JAKET THE NORTH FACE ORIGINAL,https://images.tokopedia.net/img/cache/200-square/hDjmkQ/2022/11/15/9d325b75-8bcb-4aa2-b483-28e179b0d40f.jpg,626500.0
CUCI GUDANG JAKET OUTDOOR GRADE ORI THE NORTH FACE JAKET OUTDOOR PRIA,https://images.tokopedia.net/img/cache/200-square/VqbcmM/2021/12/3/51fb55d7-0843-4a90-9914-c7bb5810486c.jpg,180000.0
Jaket The North Face Jaket Outdoor TNF Casual Jaket Gunung Anti Air,https://images.tokopedia.net/img/cache/200-square/VqbcmM/2021/4/20/3b8fa79b-0e96-486c-a3a0-2ad0be1b1bf6.jpg,155000.0
JAKET GUNUNG HIKING WINTER THE NORTH FACE GURLS NORTH DOWN HOODIE,https://images.tokopedia.net/img/cache/200-square/VqbcmM/2022/10/26/5053294f-89d0-4e08-85fa-9dcf8c51a1dd.jpg,585000.0
THE NORTH FACE JAKET WATERPROOF PAKAIAN OUTDOR PRIA TERKINI ORIGINAL,https://images.tokopedia.net/img/cache/200-square/hDjmkQ/2022/7/14/fb4d66eb-ed24-42c6-af41-5272a42f2f98.jpg,213000.0
THE NORTH FACE ATLAS TRICLIMATE MEN'S JACKET - BLACK,https://images.tokopedia.net/img/cache/200-square/VqbcmM/2022/9/29/014cbda3-6d20-416d-a8f5-379d74ea358f.jpg,950000.0
THE NORTH FACE ATLAS TRICLIMATE MEN'S JACKET - BLACK/GREY,https://images.tokopedia.net/img/cache/200-square/VqbcmM/2022/9/29/c6281423-60f9-4e26-925b-4f06f13c9a1c.jpg,950000.0
the north face Flyweight Hooded Jacket - Men's brand new without tag,https://images.tokopedia.net/img/cache/200-square/VqbcmM/2022/12/7/eb163a9f-b936-48a9-bfb1-32b79bad07e2.jpg,635000.0
Cuci Gudang Jaket Outdoor Original The North Face / Jaket Outdoor Pria,https://images.tokopedia.net/img/cache/200-square/VqbcmM/2022/4/4/0caaf1a6-0255-4093-aafd-8ba811f6ed7d.jpg,348000.0
Jaket Gunung Pria The North Face Thermoball Pullover Blue Size L,https://images.tokopedia.net/img/cache/200-square/VqbcmM/2020/9/27/708be89e-7058-489c-aaad-0fa634e9da18.jpg,1550000.0
The North Face Men Tka200 Zip In Jacket-NF0A4NA3YW2,https://images.tokopedia.net/img/cache/200-square/VqbcmM/2022/11/25/0b053733-d613-46de-86b0-9540e5f3121d.jpg,2290000.0
THE NORTH FACE JAKET WATERPROOF PAKAIAN OUTDOR PRIA TERKINI ORIGINAL,https://images.tokopedia.net/img/cache/200-square/hDjmkQ/2022/8/24/9910360d-1536-4238-ad1e-8e15e27943a1.jpg,338000.0
Jaket Pria THE NORTH FACE Men Cyclone Jacket ORIGINAL,https://images.tokopedia.net/img/cache/200-square/VqbcmM/2022/12/17/a2be278b-b1ff-4408-b09f-368cb1ddae95.jpg,2399000.0
the north face jaket dryvent,https://images.tokopedia.net/img/cache/200-square/VqbcmM/2022/11/23/e4be976d-d157-4310-9d3c-0a059fd41a52.jpg,450000.0
Jaket The North Face Waterproof Arque Futurelight Mens - Kelp Tan - XL,https://images.tokopedia.net/img/cache/200-square/VqbcmM/2022/9/16/c31d5cd0-6558-4c0f-9ead-2c069743c005.jpg,1716000.0
jaket winter The North Face Bulang puffer /goossedown syntetis promo,https://images.tokopedia.net/img/cache/200-square/hDjmkQ/2022/10/29/1ae23d95-4ab4-4dd7-8017-b2576807f4f1.jpg,309000.0
THE NORTH FACE JAKET GUNUNG OUTDOOR PRIA WANITA PARASUT ANTI AIR MURAH,https://images.tokopedia.net/img/cache/200-square/hDjmkQ/2022/10/16/d0299e2b-3894-4a64-821a-624281fecdad.jpg,378000.0
(BEST SELLER ❗️) The North Face Puffer 'Windbreaker' Jacket Black,https://images.tokopedia.net/img/cache/200-square/hDjmkQ/2022/10/3/a3b18329-7a8b-4d0a-bc55-f2ad72f9f8d6.jpg,313000.0
Jaket Outdoor The North Face Summit Series Original,https://images.tokopedia.net/img/cache/200-square/VqbcmM/2021/2/2/c0f5418d-c1f6-4f6c-b340-efcf40d901a2.jpg,250000.0
JAKET The North Face Puffer,https://images.tokopedia.net/img/cache/200-square/VqbcmM/2022/8/29/966769bb-3861-4152-9988-6e2bcfbd50fe.jpg,260000.0
jaket puncak the north face 1627 summit series,https://images.tokopedia.net/img/cache/200-square/product-1/2016/12/30/558287/558287_d61676ee-9a68-4cf3-b5f8-08464f82d21c.jpg,285000.0
Jaket Parasut Pria Jaket The North Face Jaket Outdoor Pria Jaket Pria,https://images.tokopedia.net/img/cache/200-square/VqbcmM/2021/4/14/1b05025b-fbd0-4504-bdcb-8486e089cdb1.jpg,100000.0
Jaket Pria Outdoor The North Face Jaket Gunung Waterproof Jaket Motor,https://images.tokopedia.net/img/cache/200-square/VqbcmM/2021/4/19/c73f9709-169b-41fd-9649-c9aee0638b86.jpg,100000.0
jaket outdoor the north face tnf jaket gunung waterproof windbreak,https://images.tokopedia.net/img/cache/200-square/VqbcmM/2022/11/24/eb5cc224-f428-44a2-8cc1-ea5d39c229c2.jpg,85000.0
(BEST SELLER ❗️) The North Face Puffer 'Windbreaker' Jacket Black,https://images.tokopedia.net/img/cache/200-square/hDjmkQ/2022/10/26/ede439d0-bc5f-457e-8cb7-7b7ad674da4a.jpg,368000.0
jaket the north face,https://images.tokopedia.net/img/cache/200-square/VqbcmM/2022/11/8/43cf1512-1d96-4671-8777-ad5d6d4d2fed.jpg,230000.0
The North Face Men TKA 100 Zip-In Jacket-NF0A49AEHFQ,https://images.tokopedia.net/img/cache/200-square/VqbcmM/2021/9/26/98bddafd-075a-4e8b-bb27-4e1396a714dc.jpg,1790000.0
North Face Men Jacket Asia Large (US Medium),https://images.tokopedia.net/img/cache/200-square/attachment/2019/1/15/154755676024474/154755676024474_27ef6259-1f71-46d3-94bc-509037a59419.png,1550000.0
JAKET THE NORTH FACE BOUNDARY TRICLIMATE 3 IN 1,https://images.tokopedia.net/img/cache/200-square/VqbcmM/2022/10/22/658659a2-1863-447f-924c-2ab085dca172.jpg,650000.0
Jual Running Jacket The North Face Two Tone Size M,https://images.tokopedia.net/img/cache/200-square/VqbcmM/2022/12/18/e5da3ea4-0478-46ab-98a0-9fb98c7a884d.jpg,100000.0
Jaket Pria THE NORTH FACE Men Flyweight Hoodie ORIGINAL,https://images.tokopedia.net/img/cache/200-square/VqbcmM/2022/12/17/deb36d65-0386-4f34-80f7-cf3991e273f4.jpg,2299000.0
Tnf The North face inner outer hoodie track top jacket jaket original,https://images.tokopedia.net/img/cache/200-square/attachment/2020/1/11/15787264114862/15787264114862_3b3fa968-15ef-4f08-a72e-398021b95118.png,1000000.0
Jaket Original The North Face Stretch Pocket Down Jacket Winter,https://images.tokopedia.net/img/cache/200-square/VqbcmM/2022/9/6/95250e9c-d1c0-4821-b83b-124ed0d4e0a1.jpg,700000.0
jaket the north face second SOLD,https://images.tokopedia.net/img/cache/200-square/VqbcmM/2022/9/19/fbce50d3-05ad-4ba7-8556-d297cfce6771.jpg,10000.0
Jaket The North Face big Size XXL US original,https://images.tokopedia.net/img/cache/200-square/VqbcmM/2021/12/27/9139389e-dfaf-4ebc-b47d-43213961680a.jpg,1199999.0
Terbaru..!! Jaket the north face tnf original no berghaus mammut,https://images.tokopedia.net/img/cache/200-square/product-1/2020/10/23/inv/inv_041e5652-535f-4fe7-82ea-950f24b47ef2_308_570.jpg,767000.0
Lanyard Jaket The North Face Dua Sisi Satuan Bisa Costom,https://images.tokopedia.net/img/cache/200-square/VqbcmM/2022/2/26/f48123fb-d2ca-4c1b-9e41-88df991ba042.jpg,39900.0
Jaket Pria Wanita The North Face TNF Outdoor Original sz XXL black,https://images.tokopedia.net/img/cache/200-square/VqbcmM/2021/6/29/d39e5bb7-e0ae-435c-bddc-c6f1df12f01d.jpg,2500000.0
Pufer The North Face / Jaket Gunung / Outdoor,https://images.tokopedia.net/img/cache/200-square/hDjmkQ/2022/7/14/bbfca1e5-7ce8-4220-8c00-d17ae2147a05.jpg,493000.0
Jack Wolfskin North country original Jacket waterproof,https://images.tokopedia.net/img/cache/200-square/VqbcmM/2021/9/29/dbb983ce-7335-49de-bbd4-a21f47c1da95.jpg,765000.0
jaket inner dan outer The North Face mens Thermoball Eco Triclimate,https://images.tokopedia.net/img/cache/200-square/VqbcmM/2022/11/6/f1ef47f6-806c-4234-a5bd-90a63a7bda5e.jpg,1800000.0
Jaket Tnf(The North Face)/Jaket Waterproof Anti Air/Jaket Distro/Jakrt,https://images.tokopedia.net/img/cache/200-square/hDjmkQ/2022/10/18/f8a1e0b6-7dc2-4fa2-969a-10f776f51241.jpg,675500.0
jaket winter pria The North Face Men's Canyonlands Hybrid Jacket,https://images.tokopedia.net/img/cache/200-square/VqbcmM/2022/11/6/89519719-5ea9-4585-b4dc-a7ac0b1ddcee.jpg,835000.0
JAKET TNF(THE NORTH FACE)/JAKET WATERPROOF ANTI AIR/JAKET DISTRO/JAKRT,https://images.tokopedia.net/img/cache/200-square/hDjmkQ/2022/10/29/b7888bf0-5f70-4d26-8956-064b36cc81c3.jpg,617000.0
The North Face Men Tnf Coach Jacket-NF0A5JWTJK3,https://images.tokopedia.net/img/cache/200-square/VqbcmM/2022/8/2/40e8390c-f491-4287-a28b-62baa70c8708.jpg,1614000.0
The North Face Men Arrowood Triclimate Jacket Khaki Tan-NF0A4NCLP38,https://images.tokopedia.net/img/cache/200-square/VqbcmM/2022/11/23/d8049a5d-b495-408a-a3c3-099e6c36d032.jpg,2220000.0
Jaket Parasut The North Face/Original Branded/Jaket Pria 2606,https://images.tokopedia.net/img/cache/200-square/product-1/2021/4/7/10187516/10187516_197c60ed-cfd9-42bc-b069-88a14178398b.jpg,165000.0
Hemat Jaket The North Face Waterproof Termurah,https://images.tokopedia.net/img/cache/200-square/hDjmkQ/2022/11/25/f2aebe0f-288b-4b43-a3be-1e80097e9d6b.jpg,305000.0
Jaket Pria THE NORTH FACE Men Apex Canyonwall ECO Jacket ORIGINAL,https://images.tokopedia.net/img/cache/200-square/VqbcmM/2022/12/17/6b39fdf6-732d-4ae2-8c18-be2a628b3dc4.jpg,3099000.0
The North Face Men Windy Peak Jacket-NF0A5B2GCEL,https://images.tokopedia.net/img/cache/200-square/VqbcmM/2022/11/24/b403e83a-e080-47c5-9898-1152fa2ae569.jpg,836000.0
Soft Case Motif Band The North Face Down Jacket Untuk Iphone 7 8 Plus,https://images.tokopedia.net/img/cache/200-square/VqbcmM/2022/8/16/aa38ab98-7df6-468a-871f-e792d40f9c65.jpg,113000.0
Ready Stok Cuci Gudang Jaket Outdoor Original The North Face / Jaket,https://images.tokopedia.net/img/cache/200-square/VqbcmM/2022/4/13/98b4923c-4b60-4b51-aede-573289226c7b.jpg,306000.0
Jaket Outdoor The North Face Tnf Jaket Gunung Waterproof Windbreake,https://images.tokopedia.net/img/cache/200-square/VqbcmM/2022/9/9/86fc4e97-9748-4425-bd7d-18a28411342a.jpg,162000.0
THE NORTH FACE GTX DENIM COACH JACKET NYLON BLACK DENIM 21FW-I FSA,https://images.tokopedia.net/img/cache/200-square/hDjmkQ/2022/11/14/4e1a9920-bb4d-4e8e-b322-a96a5eddb6db.jpg,3900000.0
TNF The North Face Elbert Primaloft Sumit Series Jacket,https://images.tokopedia.net/img/cache/200-square/product-1/2016/9/15/883411/883411_52bfc1a4-e508-49bd-9325-055079f426cd.jpg,1500000.0
[Dijual] The North Face Men Stretch Down Jacket-NF0A4NG4T97,https://images.tokopedia.net/img/cache/200-square/hDjmkQ/2022/11/10/bb57b5e4-ef13-44db-bc56-dc93baba0103.jpg,4156000.0
THE NORTH FACE FLEECE JACKET (Sz.L),https://images.tokopedia.net/img/cache/200-square/VqbcmM/2022/12/28/09ba2eae-05fd-4a32-ad7c-d214067b88e4.jpg,350000.0
W.ESSENTIÈLS x One Piece Jaket Tony Tony Chopper Hoodie North Carolina,https://images.tokopedia.net/img/cache/200-square/VqbcmM/2022/11/30/bc7f9e1b-b103-4b81-85b8-7ac4694e058b.jpg,549000.0
The North Face Jaket Venture Waterproof Original - Jake Limited,https://images.tokopedia.net/img/cache/200-square/product-1/2018/8/31/36092814/36092814_8473169e-50df-4351-be98-1c7dfa1cdf40_300_300.jpeg,687500.0
Jaket The North Face Jaket Outdoor TNF Casual Jaket Gunung Anti Air,https://images.tokopedia.net/img/cache/200-square/hDjmkQ/2022/10/3/0cfeaa0c-2a0c-407d-957d-ace7d4178568.jpg,259000.0
Jaket Waterproof The North Face Women Thermoball Triclimate jacket,https://images.tokopedia.net/img/cache/200-square/VqbcmM/2022/1/26/039c9f3e-94ce-4bcf-8bf4-e5e4b6fbbf15.jpg,600000.0
Jaket motor simpson - North Carolina Black and White,https://images.tokopedia.net/img/cache/200-square/VqbcmM/2022/10/20/07b17c6f-9658-48c6-bd69-e32035af4efc.jpg,1900000.0
The North Face Women Tka Glacier Full Zip Jacket-NF0A4NAQ696,https://images.tokopedia.net/img/cache/200-square/VqbcmM/2022/8/23/0bec8e58-b7a8-4f03-8164-51d6a851c034.jpg,1790000.0
Terlaris Jaket Winter The North Face Mens Clement Triclimate Jacket,https://images.tokopedia.net/img/cache/200-square/product-1/2020/1/26/86437951/86437951_242a1df0-3e86-4b4d-8a7d-a39e395583ee_674_674.jpg,2054000.0
Supreme The North Face Bleached Denim Print Nuptse Jacket L Black with,https://images.tokopedia.net/img/cache/200-square/VqbcmM/2022/12/8/facb9be8-5ab3-4d72-bdf1-e3e70d61b1a9.jpg,9000000.0
CUCI GUDANG JAKET OUTDOOR ORIGINAL THE NORTH FACE / JAKET OUTDOOR PRIA,https://images.tokopedia.net/img/cache/200-square/product-1/2020/1/25/6961779/6961779_1d97321d-3dbc-496b-9c11-553431777e21_1080_1080.jpg,190000.0
*ORIGINAL* JAKET GUNUNG / OUTDOOR THE NORTH FACE WATERPROOF / TNF,https://images.tokopedia.net/img/cache/200-square/hDjmkQ/2020/10/13/b7f7fa34-b5bc-403e-807e-b67423daee5e.jpg,182300.0
Jaket the north face dryvent waterproof dark grey black original,https://images.tokopedia.net/img/cache/200-square/hDjmkQ/2022/12/25/a028d45a-4fbf-4d40-a560-dece7742da3a.jpg,828900.0
The North Face TNF Mens Down Sierra 3.0 Outdoor Jacket ORIGINAL,https://images.tokopedia.net/img/cache/200-square/VqbcmM/2021/6/26/ba1b4b7e-73eb-4e98-a811-415321e933c3.jpg,2499000.0
Jaket Wanita The North Face Belted Mera Peak Color Grey Size M,https://images.tokopedia.net/img/cache/200-square/VqbcmM/2020/9/27/46475e13-3bf3-46e1-bd0d-993395b92f24.jpg,750000.0
Jaket Supreme X The North Face Expedition Yellow Jacket Tokodia5889,https://images.tokopedia.net/img/cache/200-square/product-1/2020/4/15/99079353/99079353_b0f7338a-a7ea-4f5f-9242-b2a9fa9b33ca_684_684.jpg,4480000.0
Jaket Casual The North Face 92 Extreme Fanorak Jacket Waterproof,https://images.tokopedia.net/img/cache/200-square/hDjmkQ/2022/11/26/59ed127a-bf77-4ea1-9162-4d6bb79e1805.jpg,1085000.0
JAKET GUNUNG HIKING TREKKING THE NORTH FACE FLYWEIGHT HOODIE MENS BLK,https://images.tokopedia.net/img/cache/200-square/VqbcmM/2022/6/11/940a222d-b655-43f4-b496-343386e0cb76.jpg,585000.0
Preloved Jaket anak Korea The North Face,https://images.tokopedia.net/img/cache/200-square/VqbcmM/2022/9/9/9e100b48-5bbf-4e8d-8447-997dd95f0b6f.jpg,300000.0
Jaket Gunung / Jaket The North Face Inner Four Barrel Triclimate,https://images.tokopedia.net/img/cache/200-square/VqbcmM/2021/8/21/c8cb33b7-c92d-4329-a9ee-36384fd495bf.jpg,480000.0
THE NORTH FACE FLEECE JACKET (Sz.S/M),https://images.tokopedia.net/img/cache/200-square/VqbcmM/2023/1/20/fc893094-2942-4cc5-8aa5-9c9c04fe722b.jpg,380000.0
jaket the north face anak Original second jaket anak uk 7/8 north face,https://images.tokopedia.net/img/cache/200-square/VqbcmM/2022/4/13/3d0b0f63-27cb-4e23-9025-919163b3caca.jpg,370000.0
Kaws x The North Face Nuptse Jacket,https://images.tokopedia.net/img/cache/200-square/VqbcmM/2022/8/7/c2525e6d-df47-425a-90f2-aed69d454633.jpg,2100000.0
JAKET THE NORTH FACE ORIGINAL DISTRO BANDUNG ANTI AIR BISA COD,https://images.tokopedia.net/img/cache/200-square/VqbcmM/2020/10/29/e4af78c3-5755-4155-a6c2-1acfdbac318d.jpg,149000.0
The North Face Jacket - Patagonia Napapijri Supreme Columbia Carhartt,https://images.tokopedia.net/img/cache/200-square/VqbcmM/2022/11/22/38241bfb-21a9-4e0b-bbeb-bbd80e0e34bb.jpg,2150000.0
The North Face Women Sangro Plus Jacket Ap-NF0A5AZZZCF,https://images.tokopedia.net/img/cache/200-square/VqbcmM/2022/11/25/b8a21c5d-9994-400a-b166-2f9d340c2ca0.jpg,3090000.0
Jaket The North Face Canyonlands Down Hybrid Jacket Original TNF Black,https://images.tokopedia.net/img/cache/200-square/VqbcmM/2022/12/21/863e7069-1fdd-4323-956e-bf309f767f81.jpg,787500.0
Jaket Windbreaker The North Face Jaket Running TNF,https://images.tokopedia.net/img/cache/200-square/hDjmkQ/2022/12/20/65adef6b-1758-40ad-98a7-b66d48722eb7.jpg,146000.0
THE NORTH FACE GORETEX MADE IN JAPAN OUTDOOR JACKET WATERPROOF (Sz.XL),https://images.tokopedia.net/img/cache/200-square/VqbcmM/2023/1/25/c5772084-d328-48ad-a049-2c4f670ede2b.jpg,320000.0
The North Face Men Apex Canyonwall Eco Jacket -NF0A4UAWDYZ,https://images.tokopedia.net/img/cache/200-square/VqbcmM/2022/11/25/5407a062-860d-4287-b98e-471d41b3f6a8.jpg,1554000.0
Jaket Ski Snow Winter Outdoor Quiksilver not the north face columbia,https://images.tokopedia.net/img/cache/200-square/VqbcmM/2022/8/28/164deacd-28b7-42d7-9ce6-72267a78c17f.jpg,750000.0
JAKET GUNUNG WATERPROOF NORTH ADVENTURE TARANTULA,https://images.tokopedia.net/img/cache/200-square/hDjmkQ/2022/9/8/33c1ed40-873a-48f2-bc02-982a128a3ca1.jpg,426000.0
The North Face Men MOUNTAIN LIGHT FL TRI JACKET - TNF BLACK,https://images.tokopedia.net/img/cache/200-square/VqbcmM/2022/12/27/7655233a-8ddd-4fcb-b22b-d1e81de5cb36.jpg,8290000.0
Jaket The North Face Men’s Flyweight Hoodie Jacket Crystal Teal,https://images.tokopedia.net/img/cache/200-square/hDjmkQ/2022/12/20/6cc27bd5-63ea-4608-b239-235cf8e441aa.jpg,732000.0
JAKET BULANG THE NORTH FACE DACRON,https://images.tokopedia.net/img/cache/200-square/VqbcmM/2021/10/15/6a9d613b-607b-444b-8aa4-d960fa7a268a.jpg,249000.0
Jaket Gunung Winter Hiking Trekking The North Face Sierra DOWN Anorak,https://images.tokopedia.net/img/cache/200-square/VqbcmM/2021/3/9/478de46a-cce3-426a-9f3b-0a4a1b0d7c67.jpg,850000.0
jaket varsity denim north bay second bekas thrift,https://images.tokopedia.net/img/cache/200-square/VqbcmM/2022/11/19/95453ee0-fea0-4fcd-8ead-99d0476b921b.jpg,350000.0
The north face thermoball eco triclimate jacket,https://images.tokopedia.net/img/cache/200-square/VqbcmM/2022/11/6/e920b934-c625-4c10-b4a9-1c36c83a5a8a.jpg,1800000.0
The North Face Men Flight Lightriser Wind Jacket-NF0A5J7CFN4,https://images.tokopedia.net/img/cache/200-square/VqbcmM/2022/6/5/e8092ed4-1384-4a15-b2fb-84d977b8b3dc.jpg,1794000.0
The North Face Men Apex Risor Jacket Jaket size M,https://images.tokopedia.net/img/cache/200-square/VqbcmM/2022/7/15/c4890a26-9da8-4dcb-a478-925288d2e5d0.jpg,500000.0
"jaket bulu angsa sintetis dakron the north face, Ultralight",https://images.tokopedia.net/img/cache/200-square/VqbcmM/2023/1/20/da248b67-9134-438d-a065-381390ae2cd1.jpg,195000.0
JAKET GUNUNG HIKING TRAVELING THE NORTH FACE ANAK NOT EIGER NOT CONSIN,https://images.tokopedia.net/img/cache/200-square/VqbcmM/2021/12/4/b4ac630e-afbd-4f13-a2c4-28c944e281be.jpg,375000.0
jaket original The North Face Inner Boy Stormy Rain Jacket size XL boy,https://images.tokopedia.net/img/cache/200-square/product-1/2017/3/1/16889260/16889260_2c95184e-2a5f-4711-a789-70bce5c4921e_480_480.png,292000.0
CUCI GUDANG JAKET OUTDOOR PRIA GRADE ORIGINAL THE NORTH FACE,https://images.tokopedia.net/img/cache/200-square/VqbcmM/2021/12/27/2ff50759-a634-4139-bd2b-24a4bc453437.jpg,187000.0
THE NORTH FACE -Original Jaket,https://images.tokopedia.net/img/cache/200-square/VqbcmM/2022/5/29/214c014e-6ad5-40d7-a765-f903f6d40d7c.jpg,575000.0
Jaket The North face Warna Hitam / Jaket Parasut Pria Waterproof Anti,https://images.tokopedia.net/img/cache/200-square/hDjmkQ/2022/8/7/7f1dfbb7-18aa-4644-906c-de2f412b9ca0.jpg,436500.0
Jaket Waterproof The North Face Men Millerton Jacket Big Size,https://images.tokopedia.net/img/cache/200-square/VqbcmM/2022/12/29/5a723266-fdac-41f1-81d0-bc3f3667f5ab.jpg,850000.0
The North Face Jacket - Patagonia Napapijri Supreme Columbia Mountain,https://images.tokopedia.net/img/cache/200-square/VqbcmM/2022/11/22/83e34eb2-a518-4b5d-8051-f071cfbfc1bb.jpg,2150000.0
Jack Wolfskin North Country Texapore Black Jacket Original,https://images.tokopedia.net/img/cache/200-square/VqbcmM/2020/12/10/57198709-816a-4809-8155-0cedef9de1a0.jpg,750000.0
Jaket Packable The North Face Men Belleview Stretch Down Jacket Winter,https://images.tokopedia.net/img/cache/200-square/VqbcmM/2023/1/4/8053b608-83d5-4f18-91ca-3c5b5bcda68e.jpg,900000.0
Jaket TNF Outdoor Anti Air Outwear The North Face Gunung Waterproof,https://images.tokopedia.net/img/cache/200-square/VqbcmM/2020/11/4/e24af984-c0bb-4014-88a3-c77e5a39c107.jpg,189000.0
Jaket Packble The North Face W Belleview Stretch Down Jacket Winter,https://images.tokopedia.net/img/cache/200-square/VqbcmM/2022/12/11/0970dc96-7ff8-4f10-8276-39e304cfcb57.jpg,800000.0
Jaket Bulu Angsa The North Face Moondoggy Reversible original not rab,https://images.tokopedia.net/img/cache/200-square/product-1/2020/6/2/2883785/2883785_45e85e0d-1cee-40ce-b1c7-b06bd7f5b904_2048_2048.jpg,850000.0
The North Face Jaket,https://images.tokopedia.net/img/cache/200-square/hDjmkQ/2022/9/16/b8a4b6c7-7eac-4ca7-ac8d-85290e3aa7cf.jpg,451000.0
The North Face Men 1994 Retro Mountain Futurelight Jacket-NF0A4R5256P,https://images.tokopedia.net/img/cache/200-square/VqbcmM/2021/9/26/ae0b1765-2714-49be-b0ff-bbe12a87881a.jpg,2396000.0
Jaket Outdoor The North Face TNF Dryvent Original,https://images.tokopedia.net/img/cache/200-square/VqbcmM/2022/2/21/37d1ca0f-94b2-4a32-8362-f20010cda8e1.jpg,480000.0
Jaket Supreme X The North Face Manhattan Metropolis Jacket Fujika12,https://images.tokopedia.net/img/cache/200-square/product-1/2020/3/19/97142894/97142894_befc2fee-d609-4f1d-8aaa-70c4824f4520_676_676.jpg,3990000.0
Jaket The North Face Resolve DryVent Original,https://images.tokopedia.net/img/cache/200-square/VqbcmM/2022/9/18/57a6f527-46f8-4a03-aab2-d4d41cb07aa6.jpg,389350.0
TNF THE NORTH FACE MENS THERMOBAL ECO JACKET SIZE S M L DAN XL NAVY,https://images.tokopedia.net/img/cache/200-square/VqbcmM/2020/10/10/80b8b1ce-2cd7-4f4b-b406-363b5ffac5e3.jpg,650000.0
jaket outdoor the north face,https://images.tokopedia.net/img/cache/200-square/VqbcmM/2020/9/22/23f8cbc0-4e15-438e-bf74-c97b6de33906.jpg,100000.0
THE NORTH FACE SOFTSHELL PREMIUM IMPORT JAKET GUNUNG OUTDOOR,https://images.tokopedia.net/img/cache/200-square/VqbcmM/2022/7/18/d8e53eb5-f29a-4d18-97d7-020f047d9dc9.jpg,245000.0
The North Face Men Tka 100 Zip In Jacket-NF0A49AE11R,https://images.tokopedia.net/img/cache/200-square/VqbcmM/2022/4/10/dc6ff61a-1481-44e1-be82-705538c759de.jpg,1790000.0
The North Face Mens Millerton Jacket Waterproof,https://images.tokopedia.net/img/cache/200-square/product-1/2017/4/4/1581801/1581801_de4ec261-a91c-44ae-8abc-6a518299f19d.jpg,700000.0
Jaket Parasut The North Face/Original Branded/Jaket Pria 2606,https://images.tokopedia.net/img/cache/200-square/VqbcmM/2021/4/9/1edc849a-3a9e-48c9-a281-b740ccf36718.jpg,165000.0
Jaket Gunung The North Face Altier Triclimate Men's Jacket Waterproof,https://images.tokopedia.net/img/cache/200-square/VqbcmM/2022/9/27/c70bb247-214a-48c9-9e6a-29e42ca09497.jpg,650000.0
Jaket Winter The North Face Bulang Puffer /Goossedown Syntetis Promo,https://images.tokopedia.net/img/cache/200-square/VqbcmM/2022/7/2/22a4ccaf-e157-48db-a335-1e01afd42ea0.jpg,197000.0
JAKET THE NORTH FACE ORIGINAL SECOND,https://images.tokopedia.net/img/cache/200-square/hDjmkQ/2022/1/18/17805cd7-e0cf-4073-aa63-7aa9dc46a42a.jpg,250000.0
Jaket Outdoor The North Face / Jaket Gunung / Jaket Taslan Waterproof,https://images.tokopedia.net/img/cache/200-square/product-1/2020/6/21/1285831/1285831_5288a9de-3e50-4bc2-bb28-ea979b745977_1080_1080.jpg,160000.0
Jaket Pria The North Face Vortex Triclimate DryVent Jacket Original,https://images.tokopedia.net/img/cache/200-square/VqbcmM/2022/12/22/28876228-e548-4cf5-aeb1-b070983501c4.jpg,579000.0
Jaket Outdoor The North Face Millerton New,https://images.tokopedia.net/img/cache/200-square/VqbcmM/2022/11/30/b787f35f-aadc-4207-9219-3f72b6541b79.jpg,620000.0
THE NORTH FACE POLARTEC JACKET (Sz.L),https://images.tokopedia.net/img/cache/200-square/VqbcmM/2023/1/20/0795707f-5c2f-49d9-9696-3d0fee7b47fe.jpg,330000.0
Puffer Jacket The North Face/Jacket Ultralight/Jacket Bulang/Jacket,https://images.tokopedia.net/img/cache/200-square/hDjmkQ/2022/12/27/992b21a1-6a63-48ac-a1a5-0a73a89d1199.jpg,295000.0
Jaket Waterproof The North Face Men Clement Triclimate Jacket Winter,https://images.tokopedia.net/img/cache/200-square/VqbcmM/2022/9/3/628851bf-f238-4edd-9975-232703f19707.jpg,800000.0
The North Face Men's Varsity Jacket brand new with tag size M mens,https://images.tokopedia.net/img/cache/200-square/VqbcmM/2022/12/23/66af428c-955f-4d93-89fc-1633607a7233.jpg,612500.0
asli Jaket Raincoat Jas Hujan TNF The North Face Navy Full Sealer,https://images.tokopedia.net/img/cache/200-square/VqbcmM/2021/6/24/c926b72b-bcae-47e9-88c7-ea248aa8c2af.jpg,314000.0
Outdoor The North Face TNF Waterproof Jacket Vintage thrift,https://images.tokopedia.net/img/cache/200-square/hDjmkQ/2022/12/20/c07779c1-d6f1-4ac0-be88-d335f97c2e16.jpg,297000.0
Jaket Gunung The North Face 2288 Waterproof Import Terlaris,https://images.tokopedia.net/img/cache/200-square/hDjmkQ/2022/6/22/81380529-277e-44d0-8d3d-ee3b6e9e9c66.jpg,357000.0
"The North Face Reversible Nuptse Jacket ""Asphalt Grey"" Original BNIPWT",https://images.tokopedia.net/img/cache/200-square/VqbcmM/2022/12/12/4766b940-ff67-48ab-be1d-d7d5e407f1c8.jpg,12000000.0
BRAIN DEAD x THE NORTH DACE DENALI FLEECE JACKET MULTI,https://images.tokopedia.net/img/cache/200-square/product-1/2019/12/17/3102573/3102573_46a59894-c65a-444e-92d3-d10d6527dc7a_640_640.jpg,6000000.0
