name,image_url,price
patagonia jacket,https://images.tokopedia.net/img/cache/200-square/VqbcmM/2022/8/30/6a60914b-4322-4d9a-9fbd-b10fca8e431f.jpg,379000.0
Patagonia Stretch Triolet Jacket 1998 Size S/M (pre-owned),https://images.tokopedia.net/img/cache/200-square/VqbcmM/2022/10/27/9bf60feb-34d6-47cb-adcf-e771861f34a0.jpg,165000.0
🔥Patagonia work jacket🔥,https://images.tokopedia.net/img/cache/200-square/VqbcmM/2021/6/21/e23634b7-889e-4d8c-9d01-bda46eef68af.jpg,680000.0
"Patagonia h2no Jacket, not arcteryx the north face fjallraven keb",https://images.tokopedia.net/img/cache/200-square/VqbcmM/2022/2/17/01a2c384-d3af-47fb-9b3d-8a1d8957fae8.jpg,600000.0
Berrybenka Street - Outer Jaket Coach Wanita Patagonia Seattle,https://images.tokopedia.net/img/cache/200-square/hDjmkQ/2022/11/16/d4779e07-1406-4b05-9987-da5465ef3a41.jpg,737000.0
Patagonia Outdoor Women Jacket Original,https://images.tokopedia.net/img/cache/200-square/VqbcmM/2022/12/25/61b43f23-d5a3-412d-b589-c958cd813bcb.jpg,410000.0
Jaket anti air Patagonia full teg,https://images.tokopedia.net/img/cache/200-square/VqbcmM/2023/1/18/995b99ad-bd0e-4405-ad4e-36a7ab85cee1.jpg,276000.0
Patagonia Houdini Snap-T Pullover jacket,https://images.tokopedia.net/img/cache/200-square/VqbcmM/2022/10/15/6e9fe1dc-5df3-43fc-bef8-8123aad2af42.jpg,1267500.0
Patagonia Hitam Hoodie Jaket Sweater Premium Skate Distro Streetwear,https://images.tokopedia.net/img/cache/200-square/hDjmkQ/2023/1/21/04108c17-47ed-4bb5-be9f-9dd2c2b1aa70.jpg,253000.0
Hoodie Patagonia full tag jaket pria wanita fashion terbaru trendi,https://images.tokopedia.net/img/cache/200-square/VqbcmM/2022/8/31/9d728e96-bf66-42b1-88a5-2009f36cd651.jpg,135000.0
Terlaris Patagonia Jaket Parasut Outdoor Tezzeron Waterproof Unisex,https://images.tokopedia.net/img/cache/200-square/VqbcmM/2022/6/20/84dadd7a-fbf9-49e3-aa14-9e51c9f46d81.jpg,341000.0
TD655 TERMURAH !! COD Jaket Sweater Hoodie Pria Distro Patagonia Big,https://images.tokopedia.net/img/cache/200-square/VqbcmM/2023/1/21/b9fa43de-e8f6-4aaf-9804-b74d479376a6.jpg,117985.0
JAKET SOFTSHELL MARMOT,https://images.tokopedia.net/img/cache/200-square/product-1/2019/1/11/2926755/2926755_feb48473-18a3-4aa1-aab3-458cdf843897_980_980.jpg,275000.0
jaket hoodie marmot,https://images.tokopedia.net/img/cache/200-square/VqbcmM/2022/11/26/1593a9ea-acaa-49ee-8284-a127e3cca446.jpg,105000.0
MARMOT SOFTSHELL POLAR JACKET (Sz.L/M),https://images.tokopedia.net/img/cache/200-square/VqbcmM/2023/1/20/43faaed2-cab3-4b88-8ac8-0b023e8b084e.jpg,190000.0
Jaket Marmot Men's Tempo Softshell Jacket NOT SALOMON TNF ARCTERYX M ,https://images.tokopedia.net/img/cache/200-square/product-1/2017/12/21/13351073/13351073_4d6268df-ac43-4e4d-92e2-a67fca77fa0e_461_600.jpg,354000.0
MARMOT SOFTSHELL JACKET (Sz.L),https://images.tokopedia.net/img/cache/200-square/VqbcmM/2022/12/15/71fe6fc2-42ff-43a8-9628-3e428998b238.jpg,180000.0
jaket outdoor marmot,https://images.tokopedia.net/img/cache/200-square/VqbcmM/2020/10/8/bcd9e301-1e90-4d52-b328-49df243db4b0.jpg,180000.0
JAKET DOWN ULTRALIGHT BRAND MARMOT,https://images.tokopedia.net/img/cache/200-square/VqbcmM/2023/1/2/858e7d6e-2c46-498a-ad3f-df5c0504d069.jpg,405000.0
Jaket Outdoor Marmot Running Jacket Black Size L,https://images.tokopedia.net/img/cache/200-square/VqbcmM/2022/11/8/79e96e4b-7b81-4240-acc6-8c97ba7d254a.jpg,35000.0
Marmot outdoor jacket ( L - XL ) pria,https://images.tokopedia.net/img/cache/200-square/VqbcmM/2023/1/14/b2aa2e09-de0e-46a3-8260-0aa3b879776e.jpg,179000.0
[DISKON] Jaket Outdoor Berkualitas (Marmot/Mustbe),https://images.tokopedia.net/img/cache/200-square/VqbcmM/2022/3/1/a600d6f2-269f-4caa-85d2-1456c61b0469.png,90000.0
Jaket Running Windbreaker NEW BALANCE MERRELL MARMOT S-L Gunung second,https://images.tokopedia.net/img/cache/200-square/VqbcmM/2022/9/18/85277a7b-f43e-4385-b659-bc606458895c.jpg,116600.0
JAKET MARMOT,https://images.tokopedia.net/img/cache/200-square/VqbcmM/2022/8/31/3fc8aec0-1140-4b53-bc09-7aa9b54b315e.jpg,230000.0
Jaket Marmot Orange Boys Fusion Jacket,https://images.tokopedia.net/img/cache/200-square/product-1/2020/4/1/765474171/765474171_b2b245b7-0624-43c3-a84a-ef369e863ba3_1280_1280.jpg,550000.0
JAKET OUTDOOR MARMOT JAKET GUNUNG PRELOVED GORETEX PACLITE,https://images.tokopedia.net/img/cache/200-square/VqbcmM/2022/11/13/027a2402-e3c4-4246-b0d0-9421492c6eba.jpg,450000.0
NEWS MARMOT OUTDOOR JACKET - JAKET OUTDOOR HIKING GUNUNG TREKING,https://images.tokopedia.net/img/cache/200-square/hDjmkQ/2023/1/17/59fb82a2-4b0e-4c4c-87d5-7b9193928355.jpg,136000.0
JAKET SOFTSHELL MARMOT,https://images.tokopedia.net/img/cache/200-square/hDjmkQ/2022/11/26/bb5dddf7-ec11-420b-9b1b-688e0d825076.jpg,385000.0
JAKET OUTDOOR CASUAL SECOND IMPORT MARMOT SIZE M 547 ANTONJEANS,https://images.tokopedia.net/img/cache/200-square/VqbcmM/2022/8/22/90e60fb6-5f8f-4937-be5e-969cde5a7677.jpg,125000.0
Marmot running jacket ( M - L ) Pria,https://images.tokopedia.net/img/cache/200-square/VqbcmM/2023/1/26/b56e5afb-c5fb-4507-85a3-c197a506d10b.jpg,229000.0
jaket outdoor second marmot - L,https://images.tokopedia.net/img/cache/200-square/VqbcmM/2021/9/6/25e872f9-b15d-4dc6-8e5a-fe6ef573f569.jpg,175000.0
Jaket bulu angsa Marmot original,https://images.tokopedia.net/img/cache/200-square/VqbcmM/2022/10/11/0d1d2b1f-f220-4874-bba7-ad22d8477d2b.jpg,285000.0
Marmot Primaloft Jaket Second Original / Bekas / Thrift / Murah,https://images.tokopedia.net/img/cache/200-square/VqbcmM/2022/12/29/c91ae6ff-60d3-4df1-9393-f9bf2fb33aeb.jpg,185000.0
Marmot PreCip Jacket,https://images.tokopedia.net/img/cache/200-square/product-1/2018/5/25/1714073/1714073_99a13c9d-8e7f-450f-9e84-848d526ec269_801_1196,1000000.0
jaket outdoor sepeda marmot bukan mammoth,https://images.tokopedia.net/img/cache/200-square/VqbcmM/2022/12/27/fc69be1c-c57e-4fd5-b225-f901acd141d9.jpg,135000.0
Jacket Hujan Marmot Womens SUPER MICA Rain Jacket Ultralight Waterprof,https://images.tokopedia.net/img/cache/200-square/product-1/2018/9/27/1859995/1859995_386fda06-04d0-4460-bb2d-ff0a4e388456_814_814.jpg,975000.0
Marmot X Munsing Wear Jaket Second Original / Bekas / Murah / Thrift,https://images.tokopedia.net/img/cache/200-square/VqbcmM/2022/12/29/f01d0bf1-3a44-40c2-a788-2b71fd95fb7d.jpg,185000.0
MARMOT Jacket Parka Dark Brown Size M,https://images.tokopedia.net/img/cache/200-square/VqbcmM/2022/8/16/348954b2-3403-43ca-868a-0e0f8058182d.jpg,340000.0
Jaket Gunung XS-5XL MARMOT Outdoor Mountain Adventure Gear Hoodie,https://images.tokopedia.net/img/cache/200-square/VqbcmM/2022/7/4/610aa209-d899-43b9-8f14-b7b1c760d426.png,145000.0
JACKET HUJAN MARMOT WOMENS SUPER MICA RAIN JACKET ULTRALIGHT,https://images.tokopedia.net/img/cache/200-square/VqbcmM/2021/9/15/e28e681e-79dc-4dac-8fb1-8e0fc3f68887.jpg,1138000.0
MARMOT jacket,https://images.tokopedia.net/img/cache/200-square/VqbcmM/2022/12/1/690aa635-8890-4fbd-82a9-1391b93edf7c.jpg,150000.0
Jacket Packable Marmot,https://images.tokopedia.net/img/cache/200-square/VqbcmM/2022/9/20/084460ba-eb66-4a16-a2cd-30e7e349f701.jpg,125000.0
Jaket Sweater Marmot Pikes Peak Hoody Jumper not patagonia arcteryx,https://images.tokopedia.net/img/cache/200-square/product-1/2019/10/19/769474/769474_0483e4e3-6b70-4768-a65d-bf7e69507fdb_1024_1024.jpg,800000.0
JAKET SOFTSHELL MARMOT,https://images.tokopedia.net/img/cache/200-square/hDjmkQ/2022/7/20/3eb1cf2d-08d9-44d1-a0d2-291302370551.jpg,391000.0
JAKET SOFTSHELL MARMOT,https://images.tokopedia.net/img/cache/200-square/hDjmkQ/2022/9/26/633922d9-bb7e-4688-9577-298fdc6a130f.jpg,402000.0
jaket marmot second,https://images.tokopedia.net/img/cache/200-square/VqbcmM/2021/10/7/3a0238b4-0817-4bba-8814-6c062f193471.jpg,280000.0
Marmot fleece jacket,https://images.tokopedia.net/img/cache/200-square/VqbcmM/2022/9/8/af7d2aef-c8bf-4840-99de-42012d368fa4.jpg,200000.0
Rain Jacket MARMOT Ultralight for Mens Ultra light Mica Orange,https://images.tokopedia.net/img/cache/200-square/hDjmkQ/2021/6/24/61fd4ab1-f04c-4b3e-87bc-8910c56a305a.jpg,1135000.0
Jaket Bulu Angsa Merk Marmot,https://images.tokopedia.net/img/cache/200-square/VqbcmM/2022/2/14/cc2611f0-84f4-4bc4-a0ce-4e13b1348854.jpg,235000.0
Jaket Marmot Gtx (SOLD),https://images.tokopedia.net/img/cache/200-square/VqbcmM/2022/10/10/b4d289d2-963b-4bcc-87e3-2779e3ce7598.jpg,250000.0
jaket outdoor marmot,https://images.tokopedia.net/img/cache/200-square/VqbcmM/2022/7/1/d69175b1-170a-48e3-84f8-451247bda523.jpg,70000.0
Jaket MARMOT,https://images.tokopedia.net/img/cache/200-square/VqbcmM/2021/12/6/49035d53-4895-4657-866f-94f885ed0050.jpg,168000.0
Marmot Camo Running Jacket Size M luar Fit L Pria,https://images.tokopedia.net/img/cache/200-square/VqbcmM/2021/10/2/f440331e-1c4c-44cb-adc0-0c9e8d606584.jpg,210000.0
marmot jacket,https://images.tokopedia.net/img/cache/200-square/VqbcmM/2023/1/4/d0db8279-3a67-4a74-8bb2-cf705b4eca09.jpg,80000.0
Sweater / Jacket - Marmot Outdoor - Hoodie / Jaket Soniamatika,https://images.tokopedia.net/img/cache/200-square/product-1/2020/3/19/97153374/97153374_8ef8b459-41f2-442a-ac4f-64f7d9bf1ed2_678_874.jpg,259000.0
Jaket Fleece Marmot Not The North Face,https://images.tokopedia.net/img/cache/200-square/VqbcmM/2021/9/20/18c461eb-5a29-4867-8a19-8d3871127ef7.jpg,249000.0
JAKET LACOSTE ORIGINAL Not PATAGONIA MARMOT MHW MILLET ADIDAS TNF,https://images.tokopedia.net/img/cache/200-square/VqbcmM/2022/6/19/ad3cd747-f2ad-46c9-b7ac-38a448996175.jpg,200000.0
Jaket Outdoor Hiking Tipis MARMOT,https://images.tokopedia.net/img/cache/200-square/VqbcmM/2022/5/23/db588bc9-fb16-4494-82cd-97622bdf48b0.jpg,100000.0
MARMOT OUTDOOR JACKET - JAKET OUTDOOR HIKING GUNUNG TREKING PUFFER,https://images.tokopedia.net/img/cache/200-square/hDjmkQ/2023/1/19/d053de9a-28af-47b8-bc4c-6adbd007c3b3.jpg,150000.0
Marmot Light Weight Jaket,https://images.tokopedia.net/img/cache/200-square/VqbcmM/2022/6/20/e1a6a0eb-98a0-4578-bbaf-0d42932c8313.jpg,155000.0
jaket outdoor dickies not tnf timberland marmot arcteryx fjallraven,https://images.tokopedia.net/img/cache/200-square/product-1/2018/11/28/3662799/3662799_b580befe-9bd1-4722-aa9a-afac020f96b2_1560_1560.jpg,360000.0
Jaket Waterproof Marmot Size M,https://images.tokopedia.net/img/cache/200-square/VqbcmM/2022/8/12/1fa727e4-afd7-4cb6-b9af-9769142f1db0.jpg,135000.0
Jaket Hoodie Beaver Dam Funny Animal Marmot,https://images.tokopedia.net/img/cache/200-square/hDjmkQ/2022/10/20/21dcdd84-62ac-4157-a98f-4689ca9b5ccc.jpg,149000.0
JAKET ROMPI MARMOT ORIGINAL SECOND LADIES,https://images.tokopedia.net/img/cache/200-square/VqbcmM/2022/8/23/5ac0358c-83ed-44af-98ed-76f03844d9b8.jpg,80000.0
jaket running marmot,https://images.tokopedia.net/img/cache/200-square/VqbcmM/2023/1/9/8b0b7dd9-4a83-4152-8d26-256db414b282.jpg,75000.0
Rain Jacket Marmot Precip Rain Jacket Ultralight,https://images.tokopedia.net/img/cache/200-square/VqbcmM/2022/2/10/c9596608-ae3d-459c-b902-93679be6ebb9.jpg,1645000.0
Rain Jacket Marmot Precip Rain Jacket Ultralight,https://images.tokopedia.net/img/cache/200-square/product-1/2019/3/30/1859995/1859995_d9f5f6b9-b7f1-4221-975d-4b7bcb1554c1_1080_1080.jpg,1150000.0
Jaket Polar Marmot Second Branded Thrift,https://images.tokopedia.net/img/cache/200-square/VqbcmM/2022/10/23/d24ba17a-67d9-4d84-934b-1c279e1ff0c4.jpg,150000.0
jaket marmot,https://images.tokopedia.net/img/cache/200-square/VqbcmM/2022/7/24/4e0860f5-07b6-4049-bebb-a2405246bcdd.jpg,65000.0
MARMOT Charcoal Half Zip Outdoor Softshell Jacket,https://images.tokopedia.net/img/cache/200-square/attachment/2018/9/6/153622339720111/153622339720111_3d2f4d67-3f20-46ad-a66e-b3b1c951fc25.png,200000.0
Jaket Kathmandu not salewa patagonia millet lafuma marmot arcteryx,https://images.tokopedia.net/img/cache/200-square/hDjmkQ/2022/9/5/373ad615-13a9-46bf-9de2-f98922990d6f.jpg,186000.0
Jaket Bomber Lightweight Marmot,https://images.tokopedia.net/img/cache/200-square/VqbcmM/2022/11/10/579173de-742d-4227-8283-75ebb49680c5.jpg,80000.0
Light Jacket Marmot Kondisi Mulus,https://images.tokopedia.net/img/cache/200-square/VqbcmM/2022/5/4/5aee0b81-c02b-42bc-b89c-f94ec52fe4fd.jpg,120000.0
Vintage Marmot Mountain Jacket,https://images.tokopedia.net/img/cache/200-square/VqbcmM/2022/12/21/7955229f-b458-4d7a-aad8-d0692bb28f84.jpg,300000.0
Marmot Packable - Jaket Outdoor Sport Pria Gunung Daleman Polar Second,https://images.tokopedia.net/img/cache/200-square/VqbcmM/2022/7/24/d5641413-7ae7-414a-93ec-c7b42bf12c08.jpg,185000.0
jaket outdoor marmot,https://images.tokopedia.net/img/cache/200-square/VqbcmM/2022/10/29/5cd492d3-89e0-4a90-af01-70238e295c61.jpg,65000.0
Marmot Primaloft Jaket Second Original / Bekas / Murah / Thrift,https://images.tokopedia.net/img/cache/200-square/VqbcmM/2022/11/18/7053f91d-9182-4e7a-b482-39a17211e8ef.jpg,185000.0
Jaket Parasut Running Marmot Second Size M,https://images.tokopedia.net/img/cache/200-square/hDjmkQ/2022/9/6/990bc57e-bdc3-4f85-a9d7-babb451509cb.jpg,98200.0
MARMOT original kaos baju t shirt jaket no eiger,https://images.tokopedia.net/img/cache/200-square/VqbcmM/2021/8/29/95f3ee02-ccb4-4289-a767-2028b435881c.jpg,50000.0
TRACK JACKET MARMOT OUTDOR PRELOVED,https://images.tokopedia.net/img/cache/200-square/VqbcmM/2022/12/14/5602fa2f-ed5f-4a99-bb1f-e018e5bea857.jpg,135000.0
Lined Jacket Marmot Quilted,https://images.tokopedia.net/img/cache/200-square/VqbcmM/2021/6/17/d2c0904d-3968-43b3-bc93-1b06a06428b1.jpg,225000.0
Jaket Bulu Angsa Marmot merah,https://images.tokopedia.net/img/cache/200-square/VqbcmM/2022/8/23/fcaf761e-02d8-4bca-8cc8-eb5371ecedb5.jpg,570000.0
jaket rompi marmot,https://images.tokopedia.net/img/cache/200-square/VqbcmM/2022/6/12/d766eca0-1639-4223-9c2a-7027a6e214c2.jpg,60000.0
Marmot Bastione Component Jacket Shell Second Preloved Jaket,https://images.tokopedia.net/img/cache/200-square/VqbcmM/2022/12/28/e6303f1d-49dc-406b-b022-87493330f34c.jpg,455555.0
jaket marmot,https://images.tokopedia.net/img/cache/200-square/VqbcmM/2022/7/26/f2e31b8f-923c-4c86-903e-486ab0d6085b.jpg,180000.0
Marmot Jaket Outdoor,https://images.tokopedia.net/img/cache/200-square/product-1/2019/7/6/6342558/6342558_111f8f20-eaff-40ab-85a7-12681c55d2c9_640_640.jpg,175000.0
SALE JAKET MARMOT SOFTSHELL TEMPO MENS NOT JWS TNF SALOMON FJALLR,https://images.tokopedia.net/img/cache/200-square/product-1/2019/4/14/53551441/53551441_4ac1248f-7d6d-4fc9-b570-c415a0f67fa4_700_886.jpg,564000.0
jaket running marmot,https://images.tokopedia.net/img/cache/200-square/VqbcmM/2022/7/12/2ae1a13e-cc44-4a73-927c-f59e149a77b4.jpg,250000.0
Preloved Jaket Hoodie Marmot Original Japan,https://images.tokopedia.net/img/cache/200-square/VqbcmM/2023/1/4/a18e4a95-1063-4c8f-97f1-ebf68e99df01.jpg,250000.0
JAKET WINDBREAKER OLAHRAGA PARASUT MARMOT,https://images.tokopedia.net/img/cache/200-square/VqbcmM/2021/1/15/ba2a898c-2f91-4a85-b797-42094e20ffda.jpg,100000.0
Jaket Bulang Marmot x Arcteryx Columbia Carhartt Mammut Patagonia Tnf,https://images.tokopedia.net/img/cache/200-square/VqbcmM/2022/9/12/4717da80-6593-4c00-91b8-576e98694dae.jpg,350000.0
JAKET MARMOT,https://images.tokopedia.net/img/cache/200-square/VqbcmM/2021/7/23/1f78ce17-7748-4a3f-b554-dce734c0fdb2.jpg,230000.0
Jaket Outdoor Tebal Marmot,https://images.tokopedia.net/img/cache/200-square/VqbcmM/2022/5/28/b3498499-873c-4c81-8ef0-f19e7fdd0b84.jpg,472500.0
JAKET PARASUT SOFT SHELL CASUAL OUTDOOR MARMOT 701 SIZE L ANTONJEANS,https://images.tokopedia.net/img/cache/200-square/VqbcmM/2020/12/15/8ef3f181-a241-44b8-9277-1c49c39793ce.jpg,150000.0
Marmot Track Jacket,https://images.tokopedia.net/img/cache/200-square/VqbcmM/2020/12/9/417ef1bf-5ac5-453f-88d2-40248a92f236.jpg,300000.0
Marmot Minimalist Gore-Tex® Waterproof Jacket,https://images.tokopedia.net/img/cache/200-square/VqbcmM/2021/4/18/93d05862-e7ac-410d-89f9-241cffff467b.jpg,3190000.0
Jacket Wind breaker Marmot With Hoodie,https://images.tokopedia.net/img/cache/200-square/VqbcmM/2022/3/30/67606448-3391-4f0e-b36f-23f23dcdfec3.jpg,150000.0
Jaket Outdoor Marmot Jaket Gunung Marmot,https://images.tokopedia.net/img/cache/200-square/VqbcmM/2022/9/28/5f646b27-9e60-4059-87b6-5ac31d1e6155.jpg,450000.0
jaket outdoor marmot second,https://images.tokopedia.net/img/cache/200-square/VqbcmM/2022/3/2/98583a19-e72c-4491-9594-add1220465c8.jpg,200000.0
Jaket Marmot Gravity Water Resistant Shoftshell Jacket,https://images.tokopedia.net/img/cache/200-square/VqbcmM/2022/7/4/5161c0d0-93a2-4a5d-a1d4-0003f3e1f731.jpg,1000000.0
JAKET MARMOT SOFTSHELL,https://images.tokopedia.net/img/cache/200-square/product-1/2019/1/12/2532015/2532015_30c5eec5-65db-4f99-aad8-d1a3d3c32462_980_980.jpg,295000.0
JAKET ANAK MARMOT,https://images.tokopedia.net/img/cache/200-square/VqbcmM/2022/12/8/6dfacaf5-2c45-415d-bff3-897c9028c1d5.jpg,50000.0
marmot precip ultralight jacket,https://images.tokopedia.net/img/cache/200-square/VqbcmM/2022/6/2/e3d26021-915d-409f-890e-fd5f095d9502.jpg,1250000.0
jaket marmot bulu angsa,https://images.tokopedia.net/img/cache/200-square/VqbcmM/2022/1/10/9e0d7087-1462-41ce-9352-b06ee2241a38.jpg,280000.0
jaket marmot / jaket marmot second / marmoot / jaket outdoor,https://images.tokopedia.net/img/cache/200-square/VqbcmM/2021/5/3/4c37c58c-f7a9-42a7-bb85-9f93d217029f.jpg,150000.0
Helly Hansen Verglas size M jaket bulang x Rab tnf marmot Patagonia,https://images.tokopedia.net/img/cache/200-square/VqbcmM/2023/1/24/0a163c8a-c646-4660-a0a6-e051cc770063.jpg,575000.0
jaket marmot wanita masih ok,https://images.tokopedia.net/img/cache/200-square/VqbcmM/2022/7/10/88ecea12-c893-49b8-afe8-75a9da562421.jpg,75500.0
jaket outdor marmot second,https://images.tokopedia.net/img/cache/200-square/VqbcmM/2022/9/9/11327fde-5717-422b-9b28-610e912edb10.jpg,250000.0
Marmot x Munsing Wear Primaloft Jaket Second Original / Bekas / Murah,https://images.tokopedia.net/img/cache/200-square/VqbcmM/2022/11/18/3fb9f9d7-28cc-46a7-bfa1-9b9289e4ba81.jpg,185000.0
MARMOT PRECIP JACKET,https://images.tokopedia.net/img/cache/200-square/hDjmkQ/2022/4/12/6d19c2df-2f95-4dda-b983-5ddef3b422e9.jpg,1450000.0
Jaket winter outdoor cewek Marmot preloved second,https://images.tokopedia.net/img/cache/200-square/VqbcmM/2022/12/7/8ece13bd-b828-4305-a472-260562bf8d45.jpg,113000.0
Jaket Specialized Marmot Bekas XL Black.,https://images.tokopedia.net/img/cache/200-square/hDjmkQ/2022/4/21/1c6ccf48-afe4-4ff0-ad7c-73a9c098758b.jpg,793000.0
"Marmot Jaket Running Putih - Windproof, Quickdry",https://images.tokopedia.net/img/cache/200-square/product-1/2019/4/21/288707/288707_5b134408-c34b-4955-bf94-7736d4d478f4_1254_1254.jpg,105000.0
rompi marmot women vest running sepeda outdoor gunung not jaket uniqlo,https://images.tokopedia.net/img/cache/200-square/VqbcmM/2022/9/30/9e952b66-8214-41b4-9959-a3d8f68f1f64.jpg,50000.0
Jaket Berghaus Goretex Paclite not patagonia mountain hardwear marmot,https://images.tokopedia.net/img/cache/200-square/hDjmkQ/2022/9/5/99fa17b3-0fc8-44bf-8c63-d72ec776929f.jpg,281000.0
Jaket Outdoor/ Jaket Parasut Wanita Merk Marmot (Real Pic),https://images.tokopedia.net/img/cache/200-square/attachment/2020/1/16/157917958741952/157917958741952_4fa91ce3-7b51-4faa-ba44-02d72816e314.png,180000.0
sale Marmot PreCip Jacket berkualitas,https://images.tokopedia.net/img/cache/200-square/hDjmkQ/2022/9/15/7af783b9-e2e3-48aa-9eaa-95c57552dc63.jpg,1540000.0
Marmot North Burma Jacket Waterproof Jaket Gunung Waterproof Tahan Air,https://images.tokopedia.net/img/cache/200-square/VqbcmM/2021/4/7/5fb6beb2-a9a5-4bb1-af1f-27fb97d378ae.jpg,2250000.0
Jaket outdoor sport hoodie wanita MARMOT second original,https://images.tokopedia.net/img/cache/200-square/VqbcmM/2022/8/28/a8d70596-5cab-4c5c-b963-b2ba36525cef.jpg,90000.0
MARMOT FLEECE JACKET SECOND,https://images.tokopedia.net/img/cache/200-square/VqbcmM/2022/6/2/4cb29163-eb9b-41d3-9e5b-7e0df4be7c98.jpg,159000.0
Jaket Running Windbreaker New Balance Merrell Marmot S-L Gunung Second,https://images.tokopedia.net/img/cache/200-square/hDjmkQ/2023/1/4/b570901c-f02f-4386-b53d-edcce26d211b.jpg,174000.0
JAKET X-NIX SECOND NOT TNF LAFUMA MARMOT,https://images.tokopedia.net/img/cache/200-square/product-1/2019/1/2/380855501/380855501_4c858f89-07e6-4162-8fee-65f83ebdba66_1080_1080.jpg,450000.0
Jaket Gunung Marmot Outdoor Jacket,https://images.tokopedia.net/img/cache/200-square/VqbcmM/2023/1/6/f86cdf5b-89da-4fd7-92a4-d2a8e0c4ee91.jpg,185000.0
Jaket Outdoor MARMOT - Outdoor Thrift,https://images.tokopedia.net/img/cache/200-square/VqbcmM/2023/1/17/b0295701-1e7f-48b0-b313-450d47bc8028.jpg,450000.0
"jaket outdoor marmot, bukan tnf,columbia,dickies",https://images.tokopedia.net/img/cache/200-square/VqbcmM/2023/1/16/5f5a7a69-608a-465a-be38-c6b141c6287e.jpg,279000.0
SALE TERHOTT !!! JAKET DOWN ULTRALIGHT BRAND MARMOT READYY,https://images.tokopedia.net/img/cache/200-square/hDjmkQ/2023/1/9/1f768314-842d-471e-8b2a-8b0fef7201af.jpg,474000.0
Marmot Coastal Sweater Hoodie jaket jumper not patagonia arcteryx tnf,https://images.tokopedia.net/img/cache/200-square/VqbcmM/2022/2/14/fe50e265-f158-4f2a-8ca7-c913e40ac7b9.jpg,800000.0
sale Marmot Air Lite Jacket bermutu,https://images.tokopedia.net/img/cache/200-square/VqbcmM/2022/8/9/050e998e-526f-4528-9e62-c56db0bec416.jpg,4958000.0
Jaket Arcteryx Buffin Hoody Mens Not Mammut Marmot The north face,https://images.tokopedia.net/img/cache/200-square/product-1/2017/8/8/0/0_a41c9121-ec93-4cfa-8aef-1b543ce1dd9e_387_516.jpg,995000.0
Jacket Hujan Marmot Womens SUPER MICA Rain Jacket Ultralight,https://images.tokopedia.net/img/cache/200-square/VqbcmM/2022/2/10/2dc9ca5f-5ffb-4c0e-a73d-c4e8391e2adc.jpg,1225000.0
Marmot PreCip Jacket,https://images.tokopedia.net/img/cache/200-square/hDjmkQ/2021/10/12/da9cb2b5-1eb7-4950-80c4-19c4c16061a9.jpg,1560000.0
MARMOT Mountain Parka Jacket,https://images.tokopedia.net/img/cache/200-square/hDjmkQ/2023/1/7/73838f19-52ae-4419-9ac9-e3dd52cb64f5.jpg,388000.0
Jaket Gunung Waterproof Marmot Optima GoreTex Paclite Jacket spor,https://images.tokopedia.net/img/cache/200-square/product-1/2019/4/12/53382053/53382053_a8bfb7bf-a5cd-4954-aef1-5cda2fec7c9c_700_700.jpg,1928000.0
Marmot Down Jacket M-3 Logo Embroidery One Point Nylon Red Size Xl,https://images.tokopedia.net/img/cache/200-square/VqbcmM/2022/6/13/70822a79-3cc7-4dbd-b593-db85f0403c2f.jpg,300000.0
JAKET DOWN ULTRALIGHT BRAND MARMOT,https://images.tokopedia.net/img/cache/200-square/hDjmkQ/2023/1/7/ad4d83e3-f63d-4a7d-bfc5-2c8ee798af0d.jpg,472000.0
sale Marmot Air Lite Jacket berkualitas,https://images.tokopedia.net/img/cache/200-square/hDjmkQ/2022/9/15/77dbe698-ee7d-4470-b66e-da41c4e7434f.jpg,5126000.0
Marmot Air Lite Jacket,https://images.tokopedia.net/img/cache/200-square/product-1/2018/5/25/1714073/1714073_fde49fd3-6b91-4e4a-8a46-9569c3cb82bf_801_1200,3350000.0
jaket outdoor gunung second bekas uniqlo not salewa mammut marmot,https://images.tokopedia.net/img/cache/200-square/VqbcmM/2022/7/7/930befb9-d0b1-458e-aec3-9770994c9fac.jpg,185000.0
sale Marmot PreCip Jacket bermutu,https://images.tokopedia.net/img/cache/200-square/VqbcmM/2022/8/9/9a32ab6c-847f-4cee-8c80-94122a6b49c0.jpg,1510000.0
jaket marmot camo not tnf mammut arcteryx,https://images.tokopedia.net/img/cache/200-square/VqbcmM/2022/10/30/b744c57a-fa03-43d4-8eac-abbb54e775bf.jpg,470000.0
Jaket Outdoor Gunung Windbreaker Hoodie NEW BALANCE ELLESSE MARMOT,https://images.tokopedia.net/img/cache/200-square/hDjmkQ/2023/1/3/32c48434-4997-4199-85a9-00539268ceae.jpg,206700.0
Jaket Arcteryx Delta Lt Not TNF Vaude Marmot Salomon Osprey Gregory,https://images.tokopedia.net/img/cache/200-square/product-1/2019/1/10/2050872/2050872_82e4574e-ef1d-4041-aaad-561bcfac91e7_1080_1080.jpg,600000.0
Jaket Outdoor Gunung Windbreaker Hoodie NEW BALANCE ELLESSE MARMOT,https://images.tokopedia.net/img/cache/200-square/hDjmkQ/2022/9/8/fcf19142-5b70-4988-895b-a9c669b1d45a.jpg,301000.0
Jaket Bulu Angsa Marmot M-3,https://images.tokopedia.net/img/cache/200-square/VqbcmM/2022/12/10/cdda8c62-c439-4b8a-9089-56891fbafc95.jpg,195000.0
Jacket MARMOT size L fit XL ( P : 74 x L : 64 ),https://images.tokopedia.net/img/cache/200-square/VqbcmM/2022/1/12/16851161-ffe0-450a-9d85-7d3ecec11cf3.jpg,230000.0
Jaket Outdoor Second Marmot Original,https://images.tokopedia.net/img/cache/200-square/hDjmkQ/2022/7/27/dc12d757-3ddd-453b-98ee-d355970ea3e1.jpg,222600.0
Jaket Outdoor Gunung Windbreaker Hoodie NEW BALANCE ELLESSE MARMOT,https://images.tokopedia.net/img/cache/200-square/hDjmkQ/2022/9/10/5f1e5d90-eda0-49f6-be66-eae75f490e01.jpg,301000.0
Murah Jaket Winter Outdoor Cewek Marmot Preloved Second Asli,https://images.tokopedia.net/img/cache/200-square/hDjmkQ/2022/11/24/2aac1bd3-e9ef-4962-8efd-196ee34f51f6.jpg,121000.0
Jaket Running Windbreaker New Balance Merrell Marmot S-L Gunung Second,https://images.tokopedia.net/img/cache/200-square/hDjmkQ/2022/12/5/d91b1909-e895-4a64-babd-7cd5d15c4e2d.jpg,194000.0
Jaket Anak Columbia Not Arcteryx Salomon The North Face Marmot,https://images.tokopedia.net/img/cache/200-square/hDjmkQ/2022/1/6/8327dd02-2ae9-4868-9e48-3b7e61d2378b.jpg,1022000.0
~[Dijual] Jaket winter outdoor cewek Marmot preloved second ~,https://images.tokopedia.net/img/cache/200-square/hDjmkQ/2022/12/28/08fd5c6f-050d-4e9b-b8d5-0bae5250a5a0.jpg,142000.0
Jaket Anak Columbia Not Arcteryx Salomon The North Face Marmot Fjallra,https://images.tokopedia.net/img/cache/200-square/VqbcmM/2021/6/17/2eb4f06d-13bf-4a8b-8629-fc5526244473.jpg,193800.0
Marmot Air Lite Jacket,https://images.tokopedia.net/img/cache/200-square/product-1/2020/8/31/114190720/114190720_f69d1cf8-f702-493c-bcac-44f66606c118_672_1020.jpg,5550000.0
Marmot Air Lite Jacket,https://images.tokopedia.net/img/cache/200-square/hDjmkQ/2021/10/12/96a0874d-dc0c-42c5-982c-465335191dc4.jpg,9313000.0
MARMOT AIR LITE JACKET,https://images.tokopedia.net/img/cache/200-square/hDjmkQ/2022/6/9/89572a12-6ee8-4011-892f-e07186e6bb2a.jpg,4350000.0
Jacket Bulu Angsa Marmot Two Tone,https://images.tokopedia.net/img/cache/200-square/VqbcmM/2021/6/11/1d5be0c4-71ae-4eb6-925a-d05535b2f9ba.jpg,200000.0
hoot sale Marmot PreCip Jacket terjamin,https://images.tokopedia.net/img/cache/200-square/VqbcmM/2022/3/2/2145539a-2434-4c82-8a58-448dedd9f0f9.jpg,1560000.0
