name,image_url,price
JAKET GUNUNG HIKING TRAVELING WINTER RAB CIRRUS FLEX MENS BLUE,https://images.tokopedia.net/img/cache/200-square/product-1/2020/3/27/3045949/3045949_0405b8bc-6377-4499-8b8f-2ef8d50a1965_554_554.jpg,850000.0
Jaket Bulu Angsa Rab Jaket Cirque Men's Insulated Duck Down Original,https://images.tokopedia.net/img/cache/200-square/VqbcmM/2021/12/22/070396bb-9ce7-49a1-beb2-06702651e86f.jpg,1250000.0
jaket rab nimbus hoodie,https://images.tokopedia.net/img/cache/200-square/product-1/2020/3/26/98607472/98607472_a10256ab-d9a9-4ed4-9b03-b7d4c8a1b5ec_972_972.jpg,2250000.0
JAKET GUNUNG HIKING TREKKING WINTER RAB NEBULA BELUGA HOODIE WOMENS,https://images.tokopedia.net/img/cache/200-square/VqbcmM/2021/8/31/1237f15e-50cd-4bae-ba02-a5b2acd51a20.jpg,1150000.0
Jaket Gunung Eiger Original Greenland Hoody Jacket Blue Xl-Not Rab,https://images.tokopedia.net/img/cache/200-square/product-1/2019/11/9/51803615/51803615_ba01cd0a-c494-4c52-bc82-5236dff479d5_980_980.jpg,694000.0
Jaket Bulu Angsa Rab Altus Insulated Duck Down Jacket Original,https://images.tokopedia.net/img/cache/200-square/VqbcmM/2021/12/23/218db737-fdd2-421b-b682-7b3cc7e04bd1.jpg,1930500.0
jaket bulu angsa no rab mountain hardwear salomon arcteryx mammut down,https://images.tokopedia.net/img/cache/200-square/VqbcmM/2022/7/12/df3659ec-6811-47c0-8ee6-ac753365619f.jpg,385000.0
JAKET RAB POSITRON JACKET BUKAN BERGHAUS ARCTERY THE NORCH FACE,https://images.tokopedia.net/img/cache/200-square/product-1/2018/6/29/0/0_b315a845-eacb-4443-8507-9cfb3bd275b6_540_532.jpg,2515000.0
Jaket Bulu Angsa The North Face Flare Down Big Size Original Not Rab,https://images.tokopedia.net/img/cache/200-square/product-1/2020/9/21/inv/inv_af45a712-04db-40ba-80c3-494c924bf662_680_680.jpg,1152000.0
Jaket Bulu Angsa Rab Nimbus Insulated Duck Down Hoodie Jacket Original,https://images.tokopedia.net/img/cache/200-square/hDjmkQ/2022/12/20/df4042c8-4e3f-407d-a0a0-2bc6f87c3b6b.jpg,4151000.0
RAB MICROLIGHT ALPINE INSULATED WOMEN'S JACKET,https://images.tokopedia.net/img/cache/200-square/VqbcmM/2022/9/10/3d7eaea5-c501-4fe2-9344-954a3c28e4cb.jpg,1499000.0
Rab microlight alpine women jacket steel,https://images.tokopedia.net/img/cache/200-square/VqbcmM/2022/11/25/96b2aba1-17b0-424f-951b-4b9d08cf6773.jpg,1800000.0
Jaket RAB Down Microlight Alpine,https://images.tokopedia.net/img/cache/200-square/VqbcmM/2022/4/7/7f53bac4-c43c-4df1-9ebf-9768a5c8f2f3.jpg,2750000.0
Packable stuff sack ultralight - stuff sack eider not rab jaket down,https://images.tokopedia.net/img/cache/200-square/product-1/2020/5/27/669391943/669391943_bbd5ffd1-2673-4bf5-82a1-17fbc60e498d_954_954.jpg,11000.0
JAKET GUNUNG HIKING TREKKING WINTER RAB MICROLIGHT ALPINE WOMENS BLACK,https://images.tokopedia.net/img/cache/200-square/VqbcmM/2022/5/13/ef8569da-53a1-410b-bf3b-33d894d363bb.jpg,1450000.0
Jaket Lighweight Rab Men'S Microlight Jacket Winter,https://images.tokopedia.net/img/cache/200-square/VqbcmM/2022/4/13/c8ea8e03-0654-4b04-bb15-ea54be800a33.jpg,1273000.0
Jaket Bulu Angsa The North Face Stretch Down Jacket Original Not Rab,https://images.tokopedia.net/img/cache/200-square/hDjmkQ/2022/7/31/7c295c69-837c-43aa-af58-8fa37ee31b16.jpg,1328000.0
ORIGINAL Jaket Outdoor Packable down HUGO BOSS Chorus Not RAB TNF FOX,https://images.tokopedia.net/img/cache/200-square/VqbcmM/2021/2/27/96b174d3-4a0d-4b08-8b68-1206f7d91dbf.png,325000.0
jaket Spyder Slalom Hodie Original,https://images.tokopedia.net/img/cache/200-square/product-1/2020/3/2/4499812/4499812_cde43362-cbcd-45f9-ae83-bf50177a3b4f_720_720.jpg,290000.0
Jaket Pria Murah Spyder Encore Blackredlist / Graylist Red,https://images.tokopedia.net/img/cache/200-square/VqbcmM/2021/8/13/0cb72b09-1a86-4105-9bd9-9345b4454906.png,215000.0
Jaket Pria Murah SPYDER Encore Black Redlist Jacket,https://images.tokopedia.net/img/cache/200-square/VqbcmM/2022/11/10/76fc0ac3-7229-4804-92f1-1cb4bb9379cf.jpg,215000.0
Spyder Wengen Blue With Black Full Zip Fleece Jacket,https://images.tokopedia.net/img/cache/200-square/product-1/2020/7/4/49358225/49358225_482e0129-5e79-421c-8e80-cc5c7749d65f_650_650,389900.0
Jaket Spyder Hodie Slalom Black Original,https://images.tokopedia.net/img/cache/200-square/product-1/2020/3/2/4499812/4499812_5dad02d8-75e8-451a-b3a3-37c8ad27bde2_720_720.jpg,290000.0
jaket spyder original dreaming Spyder Jacket Original,https://images.tokopedia.net/img/cache/200-square/VqbcmM/2020/7/9/e329fe67-9add-4806-8b82-bca412a6d0ff.jpg,265000.0
Jacket Fullzipper Winter Spyder,https://images.tokopedia.net/img/cache/200-square/product-1/2018/5/21/0/0_2d97f30c-8a19-40e5-9e9e-0656d9d808a7_1078_1077.jpg,250000.0
jaket waterproof insulated spyder fanatic,https://images.tokopedia.net/img/cache/200-square/VqbcmM/2021/4/28/a0485d09-6fba-4430-8474-787cfc19b702.jpg,500000.0
Jaket bulu angsa Spyder grand Down insulation original,https://images.tokopedia.net/img/cache/200-square/VqbcmM/2022/4/5/ded9990b-c317-456e-a221-b694f90b20f0.jpg,599000.0
Jacket Spyder 1,https://images.tokopedia.net/img/cache/200-square/product-1/2018/5/21/0/0_e835e819-e03a-4a04-8979-666f7e4c40c6_1078_1087.jpg,280000.0
jaket pria SPYDER original autentic,https://images.tokopedia.net/img/cache/200-square/VqbcmM/2021/3/31/5ac0b5b4-8b8c-42ca-8711-5f00b9c09ce6.jpg,250000.0
Jaket Second/Preloved/Bekas Branded SPYDER Snowboard Jacket Murah,https://images.tokopedia.net/img/cache/200-square/VqbcmM/2022/11/30/bfe28398-bd38-44c1-8ddc-4422be38ac91.jpg,180000.0
Jaket Branded Pria - SPYDER ENCORE BLACKREDLIST,https://images.tokopedia.net/img/cache/200-square/VqbcmM/2021/2/4/216cd23f-dbd9-4ea6-abfd-ee3c2fbefb2f.jpg,215000.0
baru Jaket Pria Murah Spyder Encore Blackredlist / Graylist Red,https://images.tokopedia.net/img/cache/200-square/VqbcmM/2022/11/5/db6e0b8e-6b79-4d06-a774-ccc89507a4c5.jpg,291000.0
Jacket Spyder Keren Banget,https://images.tokopedia.net/img/cache/200-square/product-1/2018/5/21/0/0_76cde105-c63b-4790-9da9-5258d2ad32c8_1078_1086.jpg,280000.0
Kenari Jaket Spyder Original Dreaming Of Winter Gray,https://images.tokopedia.net/img/cache/200-square/product-1/2020/3/12/97053824/97053824_4f6b2740-2139-4578-bef9-49983561457f_676_676.jpg,357000.0
Jaket Spyder Original Branded,https://images.tokopedia.net/img/cache/200-square/VqbcmM/2022/12/15/a851f762-5feb-4d0f-a748-3ceb57ed9303.jpg,124500.0
Jaket Spyder Wengen Blue With Black Full Zip Original,https://images.tokopedia.net/img/cache/200-square/VqbcmM/2021/6/29/8ae15a6e-c899-4587-9e15-2df8696a136a.jpg,429990.0
Jacket Spyder model winter,https://images.tokopedia.net/img/cache/200-square/product-1/2020/2/18/1196879/1196879_9a52a51c-9d37-4ea0-8541-35fb06b3d7ea_960_960.jpg,280000.0
Jaket Spyder,https://images.tokopedia.net/img/cache/200-square/product-1/2020/3/9/461511575/461511575_f1a46a80-f202-4416-bde2-f08fd0f70066_1280_1280.jpg,195000.0
Jacket spyder,https://images.tokopedia.net/img/cache/200-square/product-1/2020/3/7/291780037/291780037_feaae3e1-5bee-4216-b801-e6aa543dd65d_960_960.jpg,280000.0
SPYDER Ski jacket waterproof blue Size tag L fit XL (P78xL68),https://images.tokopedia.net/img/cache/200-square/VqbcmM/2022/1/9/066e79c4-12b8-4013-af2f-9b41aeb8ae21.jpg,199000.0
jaket spyder outdor,https://images.tokopedia.net/img/cache/200-square/product-1/2019/11/1/5652094/5652094_318d98be-84e4-460c-ba5e-8bf7b08d9ec9_719_719.jpg,512000.0
Terlaris Spyder Half Zip Winnter Jaket Dingin Gunung Mantul,https://images.tokopedia.net/img/cache/200-square/product-1/2020/1/26/86437951/86437951_1d9c44ff-959f-43d1-80a4-3f9ec42b308a_674_674.jpg,249000.0
SPYDER GRAND DOWN INSULATION JACKET MEN'S,https://images.tokopedia.net/img/cache/200-square/VqbcmM/2022/9/26/60152dd2-4446-44d3-9f73-eeeb372649c8.jpg,700000.0
Jaket Spyder Original Dreaming Of Winter Gray Fulana265,https://images.tokopedia.net/img/cache/200-square/product-1/2020/3/19/97141673/97141673_718218eb-a1d9-490e-b9d0-1c0a50203270_676_676.jpg,357000.0
Jaket Branded Pria - Spyder Blue-Black Jacket Fujika12,https://images.tokopedia.net/img/cache/200-square/product-1/2020/3/19/97142894/97142894_e41da3a0-6597-4764-a188-d544b52eeb21_690_690.jpg,321000.0
CNSH 17691 SPYDER SKI JACKET ,https://images.tokopedia.net/img/cache/200-square/product-1/2017/8/29/5484068/5484068_2b0eecfb-f90e-4fa9-bffd-5484a3ea9272_600_600.jpg,900000.0
JAKET SPYDER / JAKET SPYDERBILT / JAKET SPYDERBILTZ JAKET RAJUT POLAR,https://images.tokopedia.net/img/cache/200-square/product-1/2019/8/23/52940515/52940515_bd8e4ce4-ed90-4924-866d-f15bd8e06b22_2048_2048,198000.0
Jacket Fullzipper Winter Spyder Fujika12,https://images.tokopedia.net/img/cache/200-square/product-1/2020/3/19/97142894/97142894_13c23f30-9476-4ad9-ad7f-5d0bfc21db4a_682_685.jpg,350000.0
Jaket pria spyder full zipper NON COD,https://images.tokopedia.net/img/cache/200-square/VqbcmM/2022/4/11/136d8d46-1fd8-49af-b5a0-55648a0f6c92.jpg,500000.0
Jaket shoftshell spyder original,https://images.tokopedia.net/img/cache/200-square/VqbcmM/2021/5/22/fbab5f81-62fd-4613-ba32-22a1f9b803c4.jpg,450000.0
JAKET SPYDER PRIA ORIGINAL/JAKET MOTOR ORIGINAL EXPORT/JAKET DREAM OF,https://images.tokopedia.net/img/cache/200-square/VqbcmM/2022/7/16/e455984c-69c4-4244-9c79-762b8bae7bb5.jpg,295000.0
Jacket Winter merek Spyder,https://images.tokopedia.net/img/cache/200-square/VqbcmM/2022/12/29/4141bc2d-68b5-4afc-880e-5553b5a737b0.jpg,358000.0
Spyder Fullzipper Jacket Grey,https://images.tokopedia.net/img/cache/200-square/VqbcmM/2021/12/26/719d4e17-9196-49ac-93b0-25136cd30e94.jpg,813000.0
SPYDER SKY TEAM AUSTRIA PUFFER JACKET,https://images.tokopedia.net/img/cache/200-square/hDjmkQ/2022/12/12/e64c531a-603c-4078-8a16-4728321a63ef.jpg,1284000.0
jaket pria SPYDER original autentic,https://images.tokopedia.net/img/cache/200-square/hDjmkQ/2022/11/26/78ee3861-acf9-4861-9142-09389f546d5d.jpg,390000.0
"Original Bnwot Spyder Quarter Zip Jacket - Red - Merah, S Dumdum1430",https://images.tokopedia.net/img/cache/200-square/product-1/2020/3/19/97152608/97152608_47c3dd68-5d76-404f-a343-e2c5beb36885_372_572.jpg,280000.0
Jaket Gunung / Jaket Winter Spyder Men's Fanatic Insulated Ski Hoody,https://images.tokopedia.net/img/cache/200-square/VqbcmM/2021/12/21/fda0b8ee-5e35-4b77-86f0-dfd9acea3447.jpg,750000.0
spyder x audi gopro insulated softshell jacket racing nascar,https://images.tokopedia.net/img/cache/200-square/VqbcmM/2022/8/30/871ade50-86dc-4e1d-af0b-21ee1b513607.jpg,385000.0
Jaket Spyder Original,https://images.tokopedia.net/img/cache/200-square/VqbcmM/2021/4/3/809f34c8-00a4-4a18-8520-d634e2aa3a19.jpg,370000.0
Boboshop9 Jaket Pria Spyder Coral-Charcoal Jacket,https://images.tokopedia.net/img/cache/200-square/product-1/2020/3/12/97065930/97065930_f5c606f4-9dbc-4619-b32c-4bc5d59e0bd7_674_674.jpg,321000.0
Jaket Spyder Mens Shell Jagged Waterproof,https://images.tokopedia.net/img/cache/200-square/VqbcmM/2021/4/14/75772d6e-c09f-407a-a8b5-e2d7bd82282c.jpg,650000.0
"jaket SPYDER ORIGINAL, CNSH ORI, SPYDER MAN",https://images.tokopedia.net/img/cache/200-square/product-1/2019/7/3/2038108/2038108_6ea036d4-bdde-40ea-af2d-5f1d1a568f9a_1161_1161.jpg,600000.0
Jacket Winter merek Spyder,https://images.tokopedia.net/img/cache/200-square/VqbcmM/2022/11/12/22d57aea-f7e0-4975-bc6c-aec820771c7b.jpg,350000.0
Jaket pria jaket winbreker pria spyder Jaket gunung jaket outdoor ori,https://images.tokopedia.net/img/cache/200-square/VqbcmM/2022/10/16/874226c9-20a8-4600-8869-cab1b148261b.jpg,440000.0
Jaket Spyder Original Dreaming Of Winter Black Fulana265,https://images.tokopedia.net/img/cache/200-square/product-1/2020/3/19/97141673/97141673_20057129-8038-49d1-bf14-0a198ec92019_684_684.jpg,399000.0
jaket spyder original dreaming Spyder Jacket Original,https://images.tokopedia.net/img/cache/200-square/hDjmkQ/2022/11/26/104f9674-f42e-4d65-baf9-cc61a087ca39.jpg,366000.0
Jacket Spyder Winter,https://images.tokopedia.net/img/cache/200-square/product-1/2018/5/21/0/0_11cc02e1-2b4c-412e-b269-6c3129b697c3_539_543.jpg,280000.0
Jual Cnsh 17691 Spyder Ski Jacket,https://images.tokopedia.net/img/cache/200-square/VqbcmM/2022/12/7/e7f51800-f56f-44b6-82a7-ad6eb33c6769.jpg,1215000.0
Jaket Outdoor Big Size Spyder,https://images.tokopedia.net/img/cache/200-square/product-1/2019/10/26/4991932/4991932_3c4be9c1-0124-4352-b4fb-50592ba2de8a_1080_1080.jpg,300000.0
Jaket touring brutal spyder,https://images.tokopedia.net/img/cache/200-square/product-1/2015/5/7/428738/428738_01dd6afc-f46b-11e4-bea8-c4bb49bc7260.jpg,145000.0
Jaket Branded Pria - SPYDER ENCORE BLACK REDLIST JACKET,https://images.tokopedia.net/img/cache/200-square/VqbcmM/2022/11/10/219fbe49-062d-4efa-b747-bd601dc89729.jpg,165000.0
Unik Spyder Mencore Fleece Full Zip Jacket Yale Blue Original Murah,https://images.tokopedia.net/img/cache/200-square/VqbcmM/2021/9/19/58e792a9-e663-4cca-8e43-cb3ac34d6b98.jpg,380800.0
JAKET MUSIM DINGIN WINTER PRIA TERBARU JAKET MOTOR ANTI ANGIN SPYDER,https://images.tokopedia.net/img/cache/200-square/VqbcmM/2022/11/23/33c1d4e7-e372-44ee-9542-bed71f3a5a73.jpg,259500.0
jaket Spyder Slalom Hodie Original,https://images.tokopedia.net/img/cache/200-square/hDjmkQ/2022/11/26/f7243dfa-035a-4f52-940d-44fc7128cba0.jpg,406000.0
Jaket Musim Dingin Winter Pria Terbaru Jaket Motor Anti Angin Spyder,https://images.tokopedia.net/img/cache/200-square/VqbcmM/2022/12/21/cab89030-a669-47fc-b8aa-d91c7509b71c.jpg,236000.0
Jaket Outdoor Winter Spyder Boys Brink Insulated Ski Jacket Original,https://images.tokopedia.net/img/cache/200-square/product-1/2020/5/10/84493805/84493805_4af3facf-712b-4e2b-9859-f59d5cc3c6b0_1399_1399,525000.0
Jaket Casual Motor SPYDER,https://images.tokopedia.net/img/cache/200-square/product-1/2020/4/15/100058190/100058190_b639d4fc-887a-4219-ac5c-07d4b34aa0f9_678_678.jpg,1520000.0
Jaket motor brutal spyder touring bikers club tebal murah harian pria,https://images.tokopedia.net/img/cache/200-square/hDjmkQ/2022/9/10/3ed21f33-8146-4e41-84f1-2ad74cc6eb89.jpg,186000.0
Jaket outdoor SPYDER Men's insuled Fanatic jaket hoody pria spyder jak,https://images.tokopedia.net/img/cache/200-square/VqbcmM/2021/8/24/5b55190a-f840-4198-a27c-b685f5f0aaf2.jpg,550000.0
Jacket Winter merek Spyder,https://images.tokopedia.net/img/cache/200-square/hDjmkQ/2023/1/18/c89868cc-1ff9-4d5d-9430-ca364993dc00.jpg,300000.0
Jacket Winter merek Spyder,https://images.tokopedia.net/img/cache/200-square/hDjmkQ/2022/12/26/4d534ed2-0df4-48ff-bc9c-5fb6517b1d9f.jpg,353000.0
JAKET BRUTAL TOURING JAKET MOTOR SPYDER JAKET MOTOR HARIAN TAHAN AIR,https://images.tokopedia.net/img/cache/200-square/VqbcmM/2023/1/24/1c0b9f97-332f-4744-b991-72b01e11afd9.jpg,253000.0
Jaket motor brutal spyder touring bikers club tebal murah harian pria,https://images.tokopedia.net/img/cache/200-square/hDjmkQ/2022/8/24/3ca417a4-272f-49a2-8ad7-55935b54cbce.jpg,186000.0
Spyder Womens Rhapsody Insulated Ski Jacket Original,https://images.tokopedia.net/img/cache/200-square/product-1/2019/4/8/2266828/2266828_fe3f87cf-58ee-45c0-a6cc-2541cea6a983_590_590.jpg,475000.0
Original Spyder Jaket Sweater Pria Hoodie Rajut Tebal,https://images.tokopedia.net/img/cache/200-square/VqbcmM/2021/10/9/4e469e3c-1182-45e0-af53-051e494d602d.jpg,375000.0
Jacket Spyder Run Buat Jaket Olahraga Pria Original,https://images.tokopedia.net/img/cache/200-square/product-1/2019/2/1/31048522/31048522_3371b60a-9789-4e13-806b-226406939d3a_480_480.jpg,550000.0
Jacket Spyder Fujika12,https://images.tokopedia.net/img/cache/200-square/product-1/2020/3/19/97142894/97142894_cd74634c-3daa-46b9-bb51-691b92d19b2a_672_672.jpg,392000.0
Jaket Pria Murah Spyder Encore Blackredlist / Graylist Red,https://images.tokopedia.net/img/cache/200-square/VqbcmM/2023/1/4/d08d851b-56b3-4786-a9ac-7c4e9a742545.jpg,296000.0
NEWS JAKET PRIA MURAH SPYDER ENCORE BLACKREDLIST / GRAYLIST RED MURAH,https://images.tokopedia.net/img/cache/200-square/hDjmkQ/2022/12/31/809cf38b-25c9-4f97-ac22-3b49c34f4294.jpg,308000.0
Terlaris Jacket Winter merek Spyder,https://images.tokopedia.net/img/cache/200-square/hDjmkQ/2022/12/25/fdd48522-f528-4e44-939d-89ad250493b0.jpg,348000.0
jaket Spyder Slalom Hodie Original NON COD,https://images.tokopedia.net/img/cache/200-square/VqbcmM/2023/1/9/a463ed67-1bbd-4737-a79c-a5be79efee4d.jpg,493500.0
NEWS JAKET SPYDER SLALOM HODIE ORIGINAL MURAH,https://images.tokopedia.net/img/cache/200-square/hDjmkQ/2022/12/31/09acb913-69b9-4607-8588-96714b7f755b.jpg,398000.0
Jaket Pria Branded SPYDER Encore Jacket GRAYLIST RED,https://images.tokopedia.net/img/cache/200-square/VqbcmM/2021/2/12/aeb6ddab-0dcd-483e-9acf-f5ee5ee77d01.jpg,205000.0
Jaket touring motor bikers brutal spyder harian pria outdoor tebal,https://images.tokopedia.net/img/cache/200-square/hDjmkQ/2022/8/24/9b3e307c-b28d-402e-b3e4-fffbabccfb2f.jpg,186000.0
New!! Jacket Winter Merek Spyder Murah,https://images.tokopedia.net/img/cache/200-square/VqbcmM/2022/12/15/57600f72-cec4-4bc6-b698-1e89a661acac.jpg,358000.0
JAKET MUSIM DINGIN WINTER PRIA TERBARU JAKET MOTOR ANTI ANGIN SPYDER,https://images.tokopedia.net/img/cache/200-square/VqbcmM/2022/12/24/38c6ae2e-f41f-44c6-951f-eda69b87f927.jpg,227000.0
Jaket Sweater Outdoor Gunung Winter Polar Fleece Spyder not uniqlo gap,https://images.tokopedia.net/img/cache/200-square/VqbcmM/2021/3/25/9e5ff825-10d4-43e3-942a-308dd2337ecf.jpg,250000.0
Jaket Brutal Touring Jaket Motor Spyder Jaket Motor Harian Tahan Air,https://images.tokopedia.net/img/cache/200-square/hDjmkQ/2022/10/18/95c26e34-5b25-426b-ae84-5224114633e2.jpg,280400.0
Jaket Wanita Murah Spyder 03 Endur Fullzip,https://images.tokopedia.net/img/cache/200-square/VqbcmM/2021/3/8/a5d71bc2-178f-4e65-add0-53f80857a242.jpg,205000.0
jaket gunung waterproof spyder fanatic breateable and thumb hole,https://images.tokopedia.net/img/cache/200-square/VqbcmM/2021/4/28/b75b04fa-127c-47e2-91b3-928caaa6c75a.jpg,500000.0
Jacket Spyder Winter Fujika12,https://images.tokopedia.net/img/cache/200-square/product-1/2020/3/19/97142894/97142894_0386be16-5377-4999-a801-676153d2f9e4_511_515.jpg,392000.0
JAKET MUSIM DINGIN WINTER PRIA TERBARU JAKET MOTOR ANTI ANGIN SPYDER,https://images.tokopedia.net/img/cache/200-square/VqbcmM/2022/12/17/edbb67b4-b01a-4c20-a37a-706d2bd502b6.jpg,251000.0
Unik Spyder Mencore Fleece Full Zip Jacket Yale Blue Original Murah,https://images.tokopedia.net/img/cache/200-square/VqbcmM/2021/9/14/83f5e281-429b-40aa-816f-6adee043327e.jpg,380800.0
JAKET BRUTAL TOURING JAKET MOTOR SPYDER JAKET MOTOR HARIAN TAHAN AIR,https://images.tokopedia.net/img/cache/200-square/hDjmkQ/2022/12/23/b692f124-0927-4e67-a8a3-d6d8aff678f6.jpg,374900.0
Jas Ujan Consina Spyder Seal/Jaket Gunung,https://images.tokopedia.net/img/cache/200-square/product-1/2017/11/23/24842911/24842911_34f2a454-e8f1-4e79-9e54-b24763e3d648_645_1000.png,395000.0
Jual jaket musim dingin spyder Berkualitas,https://images.tokopedia.net/img/cache/200-square/VqbcmM/2021/9/17/898660d9-c788-49f3-acef-9048c2ee37b4.jpg,340000.0
JAKET MUSIM DINGIN WINTER PRIA TERBARU JAKET MOTOR ANTI ANGIN SPYDER,https://images.tokopedia.net/img/cache/200-square/VqbcmM/2022/11/26/6bf69a10-6657-401e-9ba5-2d888e76e8ba.jpg,264000.0
Jaket Musim Dingin Winter Pria Terbaru Jaket Motor Anti Angin Spyder,https://images.tokopedia.net/img/cache/200-square/hDjmkQ/2022/10/25/d46e6481-1805-4d3b-981e-b0efa5c2b1c8.jpg,330000.0
Unik Spyder Mencore Fleece Full Zip Jacket Yale Blue Original Murah,https://images.tokopedia.net/img/cache/200-square/VqbcmM/2021/9/16/06393f5d-ba22-412c-b9d7-af7e9e958f37.jpg,380800.0
Spyder Sky Team Austria Puffer Jacket,https://images.tokopedia.net/img/cache/200-square/VqbcmM/2022/8/5/d0a3cb1b-5457-4bdd-a9ac-12137335270d.jpg,850000.0
Jacket Spyder 1 Semarbaru261,https://images.tokopedia.net/img/cache/200-square/product-1/2020/4/15/99074977/99074977_c86ef9fc-2b05-419c-af62-7ecbd88c6d2c_674_674.jpg,392000.0
Jaket Pria Branded SPYDER Encore Jacket BLACKREDLIST,https://images.tokopedia.net/img/cache/200-square/VqbcmM/2021/2/12/776a1927-b66d-47a4-a03d-3c9fff376f34.jpg,205000.0
JAKET MUSIM DINGIN WINTER PRIA JAKET MOTOR ANTI ANGIN SPYDER,https://images.tokopedia.net/img/cache/200-square/VqbcmM/2022/12/7/7ed9c002-fc1e-434b-b6a4-fb998100624b.jpg,248000.0
Jaket Musim Dingin Winter Pria Terbaru Jaket Motor Anti Angin Spyder,https://images.tokopedia.net/img/cache/200-square/hDjmkQ/2022/10/18/e3d3c8c0-cf85-408a-b4a2-91f20a880527.jpg,252500.0
Jaket touring motor bikers brutal spyder harian pria outdoor tebal,https://images.tokopedia.net/img/cache/200-square/hDjmkQ/2022/9/10/2159beb1-e824-470b-8580-997d58bc29b8.jpg,186000.0
jaket spyder Encore fullziper,https://images.tokopedia.net/img/cache/200-square/hDjmkQ/2022/7/20/9ce8eca9-6675-4604-926f-792bb5657339.jpg,360000.0
jaket Spyder Slalom Hodie Original,https://images.tokopedia.net/img/cache/200-square/hDjmkQ/2022/7/19/823ea1ed-1c1d-4799-bdf0-8499cdf648e1.jpg,433000.0
Jaket Pria Murah Spyder Encore Blackredlist / Graylist Red,https://images.tokopedia.net/img/cache/200-square/hDjmkQ/2022/7/19/7717b6d4-c81a-4c44-9fa9-e1672e9ac65f.jpg,321000.0
Spyder Dermizax-EV X-Static Insulation Jacket,https://images.tokopedia.net/img/cache/200-square/VqbcmM/2021/11/16/88607109-669f-41f7-9ba7-3591f091330c.jpg,649999.0
jaket Spyder Slalom Hodie Original,https://images.tokopedia.net/img/cache/200-square/hDjmkQ/2022/9/26/52a6f5b1-5706-4e57-afbd-1ebb0653f76d.jpg,430000.0
jaket spyder original dreaming Spyder Jacket Original,https://images.tokopedia.net/img/cache/200-square/hDjmkQ/2022/7/19/f42e3373-52d3-4ea9-91dd-ddaf7e333f92.jpg,385000.0
jaket pria SPYDER original autentic,https://images.tokopedia.net/img/cache/200-square/hDjmkQ/2022/9/26/123926a3-88c2-46be-8a1e-03f9cb537d57.jpg,394000.0
jaket pria SPYDER original autentic,https://images.tokopedia.net/img/cache/200-square/hDjmkQ/2022/9/13/f983973d-cc27-486e-9d7f-4590172b8d26.jpg,388000.0
Spyder Fullzipper Jacket Grey,https://images.tokopedia.net/img/cache/200-square/VqbcmM/2021/10/30/0bee1af3-8fc8-42ef-9c9f-86dfb5e17b34.jpg,715000.0
Spyder Mens Fanatic Insulated Ski Hoody Jacket not Tnf Not Salomon,https://images.tokopedia.net/img/cache/200-square/VqbcmM/2021/2/22/37842fde-249c-4a3f-bfb3-dae41e72d136.jpg,650000.0
jaket spyder Encore fullziper,https://images.tokopedia.net/img/cache/200-square/hDjmkQ/2022/9/26/2c9604b3-0a7d-4104-87d1-936952dbcd77.jpg,370000.0
Jaket Spyder Encore Red Orange with Grey,https://images.tokopedia.net/img/cache/200-square/product-1/2020/2/14/batch-upload/batch-upload_22cc9f7d-1c95-40e8-9684-9bb31da8fb65,404000.0
Spyder outdoot jacket,https://images.tokopedia.net/img/cache/200-square/VqbcmM/2023/1/3/84bd9bbc-ee9f-4129-bc69-2f130d64f179.jpg,239000.0
Jual jaket musim dingin spyder Berkualitas,https://images.tokopedia.net/img/cache/200-square/VqbcmM/2021/9/26/0de939ff-b8ba-4a83-b011-5ae88731b6a4.jpg,340000.0
Jacket Spyder Keren Banget Soniamatika,https://images.tokopedia.net/img/cache/200-square/product-1/2020/3/19/97153374/97153374_ea65d2bf-0b52-439b-9322-3d5b4b61b90d_670_676.jpg,392000.0
Jaket Pria Jaket Winbreker Pria Spyder Jaket Gunung Jaket Outdoor Ori,https://images.tokopedia.net/img/cache/200-square/VqbcmM/2022/12/23/715c98dc-248b-4ca6-9654-56e44007898e.jpg,643500.0
hoot sale Spyder Fullzipper Jacket Grey terjamin,https://images.tokopedia.net/img/cache/200-square/product-1/2020/4/11/99497757/99497757_67fd8fe2-b4f1-4b6d-8725-dc9fed19b8c6_670_670.jpg,760000.0
Didit Jaket Pria Casual Spyder,https://images.tokopedia.net/img/cache/200-square/VqbcmM/2021/6/9/cdd96074-6024-4470-90b8-c755b7d0e448.jpg,455000.0
ORIGINAL JAKET SPYDER - MEN CONSTANT FULL ZIP MID STRYKE Not T Limited,https://images.tokopedia.net/img/cache/200-square/product-1/2019/1/29/48506583/48506583_bbb6c184-337e-40c7-bed1-fb300bd08f73_853_700.png,318000.0
Jaket Pria Outdoor Waterproof Gunung Hiking Spyder Original,https://images.tokopedia.net/img/cache/200-square/VqbcmM/2022/12/23/13c325e7-dd02-44d6-be4f-3a6d0f1865ef.jpg,665500.0
Spyder Jagged Gtx Shell Jacket Not Eiger Arcteryx Salomon Pinnacle,https://images.tokopedia.net/img/cache/200-square/VqbcmM/2020/10/20/6fc325e7-edfc-4829-b717-8212de65f2f3.jpg,700000.0
jaket pria outdoor waterproof gunung hiking spyder original,https://images.tokopedia.net/img/cache/200-square/VqbcmM/2022/6/18/fc780829-404b-4c61-a714-dc02f89862d8.jpg,449000.0
JAKET MUSIM DINGIN WINTER PRIA TERBARU JAKET MOTOR ANTI ANGIN SPYDER,https://images.tokopedia.net/img/cache/200-square/VqbcmM/2022/7/14/40bece92-c12c-4ae6-8da8-35544676c4f8.jpg,236000.0
New Jaket Motor Brutal Spyder Touring Bikers Club Tebal Murah Harian,https://images.tokopedia.net/img/cache/200-square/VqbcmM/2022/11/7/26bc9f5b-9002-48ff-91da-b3c8166b4bd8.jpg,208000.0
New Jaket Touring Motor Bikers Brutal Spyder Harian Pria Outdoor Tebal,https://images.tokopedia.net/img/cache/200-square/VqbcmM/2022/11/7/9eb3ed51-13dd-4d3a-b6b2-1189c56e3a5b.jpg,209000.0
jaket spyder shoftshell water repellent original,https://images.tokopedia.net/img/cache/200-square/VqbcmM/2022/12/2/40079769-7db6-4c7f-90cb-50701ad7d464.jpg,300000.0
spyder alps hooded jacket,https://images.tokopedia.net/img/cache/200-square/VqbcmM/2021/2/15/e499ce41-eedd-498a-9fbc-92f9f4436696.jpg,350000.0
Jual jaket musim dingin spyder Berkualitas,https://images.tokopedia.net/img/cache/200-square/VqbcmM/2021/9/15/0683515f-aef1-4064-927c-05e05551fa9c.jpg,340000.0
iner jaket spyder,https://images.tokopedia.net/img/cache/200-square/VqbcmM/2022/11/19/7967f27a-b00f-4531-a3ef-5f5a8d180ce6.jpg,50000.0
Jaket Spyder Men'S Fanatic Jaket Hoody Pria Spyder Akhirshop,https://images.tokopedia.net/img/cache/200-square/VqbcmM/2022/8/12/6db988ab-bd77-4d82-bff8-a555a06d3623.jpg,652000.0
JAKET MUSIM DINGIN WINTER PRIA TERBARU JAKET MOTOR ANTI ANGIN SPYDER,https://images.tokopedia.net/img/cache/200-square/hDjmkQ/2022/4/12/233193bc-37ee-49ee-a010-d03ef4ab4610.jpg,226000.0
Spyder Softshell Jacket - Size 100/M-L,https://images.tokopedia.net/img/cache/200-square/VqbcmM/2022/12/28/e85eb02e-42ee-4954-a038-6af13d807b1c.jpg,200000.0
Spyder Men's Sensor Ski Jacket ⛷️ - Size L,https://images.tokopedia.net/img/cache/200-square/VqbcmM/2022/1/23/d1b533bd-75f9-4345-8e35-a58aa9695d51.jpg,950000.0
