name,image_url,price
Terbaru..!! jaket millet goretex xcr not mammut salewa fjallraven,https://images.tokopedia.net/img/cache/200-square/product-1/2020/10/23/inv/inv_2b2b15c4-aef2-499a-a913-cb3e14f30e9b_400_570.jpg,699000.0
Salomon Mens Drifter Air Hoodie Jacket Original Not Salewa Berghaus,https://images.tokopedia.net/img/cache/200-square/product-1/2020/3/26/98607472/98607472_440d0ac7-075b-42c8-ae76-d539407cfa74_974_1274.jpg,818000.0
Jaket Gunung Rab Neutrino Pro Not Salewa Salomon,https://images.tokopedia.net/img/cache/200-square/VqbcmM/2021/8/12/8b2d9368-dc71-41ea-becb-792847eb231d.jpg,1545000.0
Columbia Men's Outdry Ex Blitz Jacket not tnf rab Salomon salewa mille,https://images.tokopedia.net/img/cache/200-square/product-1/2019/9/17/3378226/3378226_db6809f3-1fdd-442e-bfd9-daaf40ef543b_762_762.jpg,850000.0
Terbaru..!! jaket millet mlimited annapurna not fjallraven salewa,https://images.tokopedia.net/img/cache/200-square/product-1/2020/10/23/inv/inv_9cfd03e7-eaa7-4b00-b010-0a0fe09e9967_318_580.jpg,640000.0
Jaket Parasut SALEWA Second Size XL,https://images.tokopedia.net/img/cache/200-square/VqbcmM/2022/11/30/15e97c9a-aa1b-445a-be1d-927a0dfebb84.jpg,62000.0
Jaket Polar Salewa Buffalo Fleece Polarlite Womens Bisa Untuk Mens,https://images.tokopedia.net/img/cache/200-square/product-1/2018/12/31/7027670/7027670_09133af9-620a-4f82-a8d0-864164902f56_960_960.jpeg,175000.0
Jaket Polartec Salewa Fleece Polar Outdoor Musim Dingin Half Zip,https://images.tokopedia.net/img/cache/200-square/product-1/2020/3/26/98607472/98607472_ce593020-65f6-441d-ae99-92914469249d_974_974.jpg,225000.0
Jaket Gunung LOWE ALPINE SALEWA M-XL Outdoor Hiking Waterproof second,https://images.tokopedia.net/img/cache/200-square/VqbcmM/2022/9/18/5962c834-276e-47b6-a1a2-1ef17b0bdf49.jpg,296800.0
Salewa jaket parka waterproof size XL fit XXL second,https://images.tokopedia.net/img/cache/200-square/VqbcmM/2023/1/23/853eaacf-58d3-4661-acc6-59d8072ffd93.jpg,150000.0
Jaket salewa alpine estrem original second,https://images.tokopedia.net/img/cache/200-square/VqbcmM/2022/3/11/0ebe6f35-8f29-437d-ac85-0910b4f4b449.jpg,250000.0
Salewa Women jacket white edition,https://images.tokopedia.net/img/cache/200-square/VqbcmM/2022/6/8/40224f4d-29ef-4f65-9169-ab790a03076e.jpg,100000.0
Jaket Bulu Angsa SALEWA FP700 XL-XXL Bulang Down Hoodie Gunung second,https://images.tokopedia.net/img/cache/200-square/VqbcmM/2022/11/7/84c6f4e6-43fb-45cb-9892-efeed4ba8dbb.jpg,333900.0
TNF Mens Clement Tri climate Jacket not Rab Millet Salewa,https://images.tokopedia.net/img/cache/200-square/product-1/2019/7/1/3378226/3378226_3d18dc3f-905e-4f11-a8b0-7427dace49de_960_960.jpg,1290000.0
Jaket Softshell Makalu Rockwood Shell Original not Eiger. Arei. Salewa,https://images.tokopedia.net/img/cache/200-square/VqbcmM/2020/12/6/8d3c7655-ab8f-4609-9ece-22bc0bb9d558.jpg,215000.0
Terbaru..!! jaket millet expert series not fjallraven salewa mhw,https://images.tokopedia.net/img/cache/200-square/product-1/2020/10/23/inv/inv_85d611a3-548a-4cca-a6f7-78533e99e046_318_580.jpg,381000.0
Jaket Gunung DICKIES SALEWA BLACKYAK size M-XL Hoodie Outdoor Hiking,https://images.tokopedia.net/img/cache/200-square/hDjmkQ/2022/12/20/56009e0c-a682-424d-9213-807601f5865b.jpg,357000.0
JAKET INNER POLAR FLEECE SALEWA,https://images.tokopedia.net/img/cache/200-square/VqbcmM/2021/10/6/8201786f-7c87-4a40-a402-c169d58c4c5a.png,164750.0
Terbaru..!! jaket running descente not lafuma salewa haglofs berghaus,https://images.tokopedia.net/img/cache/200-square/product-1/2020/10/23/inv/inv_c35dae50-7bf5-4ce8-acf1-52cbce6a1f94_434_584.jpg,150000.0
jaket second bekas the limited not milet laguma k2 salewa dikies,https://images.tokopedia.net/img/cache/200-square/VqbcmM/2021/4/14/e8b9cc0a-8736-4c83-ab60-fd8297783e43.jpg,150000.0
jaket salewa,https://images.tokopedia.net/img/cache/200-square/VqbcmM/2022/9/26/da39bb20-765a-4369-b0e3-3d73df1b863b.jpg,135000.0
Jacket parasut Salewa tipis,https://images.tokopedia.net/img/cache/200-square/VqbcmM/2022/4/7/fc0c0618-64b2-41a8-865b-25005d24deec.jpg,100000.0
Terbaru..!! jaket killy asics not patagonia salewa tnf eiger goretex,https://images.tokopedia.net/img/cache/200-square/product-1/2020/10/23/inv/inv_8da19a52-f80a-47bb-a007-58c4ead9ed4e_455_570.jpg,315000.0
Jaket Thrift Hoodie Salewa Original Second Import Bekas FD20,https://images.tokopedia.net/img/cache/200-square/VqbcmM/2022/10/6/6dabf9eb-6c2b-4cc0-94a5-7d2b0e0474e7.jpg,55000.0
Jaket Polar Columbia Fast Trek Light Full Zip Rab Patagonia Salewa,https://images.tokopedia.net/img/cache/200-square/VqbcmM/2022/4/26/18272bc9-f75a-45e1-bab0-8cc949d5538d.jpg,200000.0
salewa jacket,https://images.tokopedia.net/img/cache/200-square/VqbcmM/2022/9/19/253fe80f-b3a5-41ea-aede-5763f067a338.jpg,250000.0
columbia straight line insulated jacket hiking not salewa salomon,https://images.tokopedia.net/img/cache/200-square/VqbcmM/2021/3/19/b6256e29-772f-449e-b4bc-2436946c4ed6.jpg,550000.0
jaket salewa casnago full Zip Hoodie original not tnf Rab mammut,https://images.tokopedia.net/img/cache/200-square/product-1/2020/3/26/98607472/98607472_ed9ef39b-4e88-4e07-8637-1dfa9e477241_972_972.jpg,613000.0
Salewa Buffalo Polarlite Blue Jacket.,https://images.tokopedia.net/img/cache/200-square/product-1/2020/3/23/6977219/6977219_85fded7c-0442-4ea3-9702-b1efdf4dffd8_719_719.jpg,325000.0
tnf seasonal jacket no eiger rei consin columbia salewa,https://images.tokopedia.net/img/cache/200-square/product-1/2019/3/2/2963646/2963646_3df0de58-897d-492a-98ed-21ab7f5bd477_477_477.jpg,1035000.0
Newproduk Jaket Polartec Salewa Fleece Polar Outdoor Musim Dingin Half,https://images.tokopedia.net/img/cache/200-square/product-1/2020/1/26/86437951/86437951_8409b4a5-470c-4826-a6ad-8166fd33e550_688_688.jpg,294000.0
Salewa goretex jaket,https://images.tokopedia.net/img/cache/200-square/VqbcmM/2023/1/19/53a1193b-b7d4-4399-bf5f-64b95782179d.jpg,150000.0
jaket salewa buffalo full Zip original not tnf jws eiger Rab,https://images.tokopedia.net/img/cache/200-square/product-1/2019/5/14/1968036/1968036_28bbbb49-f95e-4594-9833-6ad6f5cb9c3f_520_520.jpg,249000.0
ORIGINAL Jaket Outdoor Salewa puez Not RAB Arcteryx FOX ASICS Salomon,https://images.tokopedia.net/img/cache/200-square/VqbcmM/2021/5/1/559c3718-4c0a-49c6-a9a1-39a645655ea4.png,315000.0
Jaket Outdoor Salewa Size M,https://images.tokopedia.net/img/cache/200-square/VqbcmM/2022/11/4/444fc816-c7b2-4953-8945-974fbe7ebd24.jpg,150000.0
Jaket Air Softshell Salewa original size L,https://images.tokopedia.net/img/cache/200-square/VqbcmM/2022/11/30/8289b999-3d4f-436d-8e7d-5ddfadc492c2.jpg,200000.0
Jaket Bulu Angsa Salewa,https://images.tokopedia.net/img/cache/200-square/hDjmkQ/2022/10/29/3a30683c-1f3b-4488-831b-844c28bdc9fd.jpg,1190000.0
Jaket outdoor gunung Salewa Mountain GTX - Red original preloved⁹,https://images.tokopedia.net/img/cache/200-square/VqbcmM/2022/8/12/2a7af041-171f-4a25-aa6f-7ae59bea8832.jpg,350000.0
Jaket outdoor Salewa Miage PTX original preloved,https://images.tokopedia.net/img/cache/200-square/VqbcmM/2022/10/11/e240239e-5270-4f41-bc55-549814e80a2a.jpg,225000.0
SALE GERCEP!!! JAKET WINDBREAKER SALEWA JAKET SALEWA JAKET LARI NO,https://images.tokopedia.net/img/cache/200-square/hDjmkQ/2023/1/9/0ec477f2-c11b-4b4b-b0be-580bc0dcbd1c.jpg,233000.0
Salewa Ortles 2 PTC MF fleece mens jaket outdoor blue,https://images.tokopedia.net/img/cache/200-square/VqbcmM/2022/2/22/2787f2e8-3d75-4009-93ec-eec1a51801e1.jpg,250000.0
Salewa Buffalo Macaw Green Jacket.,https://images.tokopedia.net/img/cache/200-square/product-1/2020/3/23/6977219/6977219_ab9dacb1-17b4-4842-9bc3-a46b89f6e557_718_718.jpg,325000.0
KATHMANDU PACK AND GO POCKET WOMENS RAIN JACKET Not Salewa Not Tnf,https://images.tokopedia.net/img/cache/200-square/VqbcmM/2022/12/16/eebbbebd-afea-4f7c-ab75-ccbae27b78a1.jpg,525000.0
Jaket Kathmandu not salewa patagonia millet lafuma marmot arcteryx,https://images.tokopedia.net/img/cache/200-square/hDjmkQ/2022/9/5/373ad615-13a9-46bf-9de2-f98922990d6f.jpg,186000.0
JAKET GUNUNG OUTDOOR SECOND WATERPROOF SALEWA GORETEX- L fit XL,https://images.tokopedia.net/img/cache/200-square/VqbcmM/2021/7/14/1ff832cb-c49f-441f-9aaa-0cd54b7e05f2.jpg,220000.0
Jaket Fleece Salewa Rainbow Cewek Polartec Wanita Musim Dingin Winter,https://images.tokopedia.net/img/cache/200-square/product-1/2019/5/1/1066815/1066815_4e809048-473b-447d-bdb0-1ac9c1adc7cb_1560_1560.jpg,130000.0
Terbaru..!! jaket descente eks wind breaker not lafuma montbell salewa,https://images.tokopedia.net/img/cache/200-square/product-1/2020/10/23/inv/inv_b2ef8713-20b2-4e5f-8f2a-df77104e93fe_469_580.jpg,158000.0
Terbaru..!! JAKET OUTDOOR KOLON SPORT SECOND NOT SALEWA SALOMON EIGER,https://images.tokopedia.net/img/cache/200-square/product-1/2020/10/23/inv/inv_0075f1c2-c15e-4901-a26e-f32a6b1a2a04_576_426.jpg,239000.0
Jaket Outdoor Salewa 2 (SOLD),https://images.tokopedia.net/img/cache/200-square/VqbcmM/2021/6/17/6474ada6-0474-4559-9111-98b0efd4d3b6.jpg,150000.0
Jaket Polar salewa,https://images.tokopedia.net/img/cache/200-square/product-1/2019/10/20/5701698/5701698_6d8dd140-481f-4bed-9ef5-55dccaf7912a_958_958.jpg,115000.0
Jaket Salewa Mid layer Half Fleece 2 way stretch polarlite Women's,https://images.tokopedia.net/img/cache/200-square/VqbcmM/2023/1/1/3c24bf7e-8e50-469e-afe2-5040b9cc6487.jpg,245000.0
Jaket Outdoor Salewa Black Second Original Murah,https://images.tokopedia.net/img/cache/200-square/VqbcmM/2021/6/7/ae21416a-fbb1-4d20-98ae-bdaeaa8f5f5e.jpg,230000.0
jaket salewa goretex,https://images.tokopedia.net/img/cache/200-square/VqbcmM/2022/11/6/9cf0b909-0a97-436e-b9d6-c0d478bf1dda.jpg,150000.0
Kathmandu Epic Mens Down Jacket V2 550 not tnf jw mhw salewa berghaus,https://images.tokopedia.net/img/cache/200-square/product-1/2020/8/31/114190720/114190720_577440df-16fe-44ae-9d98-01ffae049d71_680_680.jpg,1424000.0
Jaket Outdoor Gunung Salewa Second,https://images.tokopedia.net/img/cache/200-square/hDjmkQ/2022/9/27/5016516b-f401-41f5-b7bb-2e81081c1968.jpg,210000.0
Salewa windbreaker Jacket,https://images.tokopedia.net/img/cache/200-square/VqbcmM/2021/12/20/b87c7566-f10a-430f-93c8-552414e2f9b0.jpg,120000.0
sasangkala ORIGINAL Jaket Outdoor Salewa Pike Dry Not Salomon The,https://images.tokopedia.net/img/cache/200-square/hDjmkQ/2021/11/3/63145b8d-4d3b-4867-8e9f-5b431f659142.jpg,382000.0
( jaket ) Packable jacket - Jaket Running Salewa original - salewa,https://images.tokopedia.net/img/cache/200-square/hDjmkQ/2022/11/7/4721c79e-1c77-4ab5-a3c4-ac1e520618fe.jpg,184000.0
JAKET GUNUNG POLAR FLEECE SALEWA ORIGINAL HIKING CAMPING SIZE S BLUE,https://images.tokopedia.net/img/cache/200-square/VqbcmM/2021/11/4/256e8900-0e3f-402c-8fb7-b650c2f9d8c2.jpg,375000.0
"Jaket Polar Salewa Warna Hijau Muda, lengan Hijau Tua",https://images.tokopedia.net/img/cache/200-square/product-1/2019/11/3/5701698/5701698_f52a703c-4b40-488b-8a41-2be614870f53_771_771.jpg,115000.0
Jaket Softshell Salewa w Pordoi PL Jacket Windbreaker,https://images.tokopedia.net/img/cache/200-square/VqbcmM/2022/10/17/dee93531-377d-4983-8d7b-a8e162a5afbe.jpg,450000.0
Jaket Sweater Hoodie Salewa Pordoi PL Fleece Jacket Winbreaker Ori,https://images.tokopedia.net/img/cache/200-square/VqbcmM/2022/10/31/8ffcde75-55f5-4395-98f8-9901b09d3377.jpg,450000.0
Jaket Bulu Angsa Salewa Brenta RDS Down Men,https://images.tokopedia.net/img/cache/200-square/VqbcmM/2022/9/9/198ffd97-d5b5-461b-8c10-09fd0442a8f5.jpg,900000.0
ORIGINAL Diskon Perlengkapan Jaket Polartec Salewa Fleece Polar,https://images.tokopedia.net/img/cache/200-square/VqbcmM/2022/7/31/f6887302-d9a8-4127-a1ff-e1c4da6b596d.jpg,234000.0
JAKET GUNUNG MID LAYER SALEWA TRAVERTINE ORIGINAL -NOS- SIZE - XS,https://images.tokopedia.net/img/cache/200-square/VqbcmM/2022/9/14/5e35a323-5d53-49a1-aa3b-489691af9dcd.jpg,425000.0
Jaket Polar Salewa Hijau Ungu Corak,https://images.tokopedia.net/img/cache/200-square/product-1/2019/10/20/5701698/5701698_cd2a97d9-0abc-46c9-8e52-5e2b920202d7_958_958.jpg,115000.0
Original Rompi Salewa Fanes Down Vest Bulu Angsa Ultralight jacket Not,https://images.tokopedia.net/img/cache/200-square/product-1/2019/1/7/46389838/46389838_d92e69f4-56ee-4337-9a54-8f34a9613cb9_972_972.jpg,1625000.0
salewa north try insulate jacket not mountain hardwear the north face,https://images.tokopedia.net/img/cache/200-square/product-1/2017/2/20/1242657/1242657_6a509fdb-8114-49b6-b1ce-8e87225aed1c,500000.0
Jaket Bulu Angsa Salewa Brenta RDS Down Women,https://images.tokopedia.net/img/cache/200-square/VqbcmM/2022/9/9/424a31bc-9c4d-42d1-8bfb-b7e2047a1a94.jpg,850000.0
jaket outdoor second salewa size l fit xl,https://images.tokopedia.net/img/cache/200-square/VqbcmM/2022/3/6/302ebc7b-a808-4b2a-b9de-5f0b90d8aaa0.jpg,275000.0
jaket tipis sport olahraga SALEWA running jogging lari second preloved,https://images.tokopedia.net/img/cache/200-square/VqbcmM/2022/12/1/930d9292-23fc-485e-95c4-92a0029837eb.jpg,100000.0
Salewa outdoor jacket ( L - M ),https://images.tokopedia.net/img/cache/200-square/VqbcmM/2021/12/3/52289025-69d9-4ce6-b2be-abcf2b892ab1.jpg,229000.0
Jaket Outdoor Sport Salewa Original Thrift Second Preloved Hitam M032,https://images.tokopedia.net/img/cache/200-square/VqbcmM/2022/9/20/e7245ab0-e293-4ca5-ba96-2ad4be6e56f7.jpg,105000.0
ORIGINAL Inner Jacket Salewa - Buffalo 3.0,https://images.tokopedia.net/img/cache/200-square/product-1/2020/3/26/98607472/98607472_3aaeea4b-9005-44b3-bf8f-afbe2ea691fb_986_922.jpg,482000.0
Salewa July Polar Fleece Jaket Original Hangat Ringan Lembut,https://images.tokopedia.net/img/cache/200-square/product-1/2016/10/3/840480/840480_e3de1fd5-75a6-4ccd-a4d8-8c6e5b70b9e6.jpg,230000.0
jaket salewa,https://images.tokopedia.net/img/cache/200-square/VqbcmM/2023/1/26/dfc17d95-75da-41f2-85f3-77332bbc3231.jpg,200000.0
Jaket Gunung - Salewa - L - JH 32,https://images.tokopedia.net/img/cache/200-square/VqbcmM/2021/9/22/b622e52e-a037-4c8c-b616-03852b401926.jpg,125000.0
Jaket Gunung Fjallraven Keb Mens Original not Salewa. Napapijri.,https://images.tokopedia.net/img/cache/200-square/VqbcmM/2020/12/11/05c58560-ba9a-4d4b-bd13-67205e3d4359.jpg,5499000.0
Salewa Jacket Softshell Polarlite,https://images.tokopedia.net/img/cache/200-square/VqbcmM/2021/3/3/d4f778c0-ef6b-41e2-aac6-efa5e11f61d8.jpg,200000.0
JAKET OUTDOOR SALEWA,https://images.tokopedia.net/img/cache/200-square/VqbcmM/2021/12/5/34352a34-50b9-4d72-a17a-901110e7fc41.jpg,130000.0
Salewa Oudoor Jacket,https://images.tokopedia.net/img/cache/200-square/VqbcmM/2021/9/19/059f9fcc-5472-4a48-b32f-ca8f39b75efb.png,170000.0
jaket salewa fanes buffalo polarlite women original not Rab tnf,https://images.tokopedia.net/img/cache/200-square/product-1/2019/5/14/472538031/472538031_9196850e-c90c-4c0c-986f-62acbd3b1bf4_700_700.jpg,249000.0
ORIGINAL Jaket Outdoor Gunung Salewa Pike DRY Not RAB Salomon TNF FOX,https://images.tokopedia.net/img/cache/200-square/VqbcmM/2021/5/29/9c7002f7-b896-4904-b9cd-603bb3058f72.jpg,200000.0
Jaket Salewa Woman Series,https://images.tokopedia.net/img/cache/200-square/product-1/2019/11/17/5701698/5701698_071c7aa4-ed3d-4c28-aa73-018a105c69fb_780_780.jpg,150000.0
Salewa WindStopper 3Layer Lady Outdoor Jacket,https://images.tokopedia.net/img/cache/200-square/VqbcmM/2022/8/23/1fa5a1ad-4616-4835-886b-a30a544a8d34.jpg,95000.0
ready Jaket Windbreaker Salewa Jaket Salewa Jaket Lari No Jaket Gunung,https://images.tokopedia.net/img/cache/200-square/VqbcmM/2023/1/6/e451d7d1-f5f7-4a7b-ac40-e1e8255f9043.jpg,255000.0
🔥Salewa outdoor jacket🔥,https://images.tokopedia.net/img/cache/200-square/VqbcmM/2021/4/20/33ef0ab4-3480-4671-a3f3-cfaaf5886570.jpg,425000.0
jaket salewa,https://images.tokopedia.net/img/cache/200-square/VqbcmM/2022/12/15/8ba368d5-10c0-49e9-963e-aa0767791d91.jpg,820000.0
jaket lari running sepedahan salewa no rab mammut cannon dale giant,https://images.tokopedia.net/img/cache/200-square/VqbcmM/2022/3/27/d336bacf-874a-47f2-afb4-a2a09cc1614c.jpg,285000.0
Jaket SALEWA UK S RED OUTDOOR,https://images.tokopedia.net/img/cache/200-square/VqbcmM/2022/7/30/6dede4a5-1deb-472a-a9b9-00c17bbecbfa.jpg,100000.0
jaket salewa buffalo polarlite original,https://images.tokopedia.net/img/cache/200-square/VqbcmM/2022/10/7/c29a1ddd-8084-4be1-862a-d50efbc7a2b9.jpg,370000.0
Jaket Gunung Polar Fleece Salewa Size S Blue,https://images.tokopedia.net/img/cache/200-square/VqbcmM/2021/11/4/07516f44-146d-4f47-a825-1b379916bd8d.jpg,275000.0
Salewa Women Jacket,https://images.tokopedia.net/img/cache/200-square/VqbcmM/2021/11/6/c47c06d9-9b6d-480e-add3-aff3418eb9a4.jpg,155000.0
Jaket Salewa Lagazuoi 2 Mens Down not Patagonia Eiger Fjallraven Tnf,https://images.tokopedia.net/img/cache/200-square/product-1/2020/1/7/45383680/45383680_968d83dc-f0f4-4f39-84ef-419ef23fe785_1000_1000,950000.0
TERBARU SALEWA ORTLES 2 PTC MF FLEECE MENS JAKET OUTDOOR BLUE PROMO,https://images.tokopedia.net/img/cache/200-square/hDjmkQ/2022/7/20/5c7438a4-4ba8-416a-ad11-422e0006b1e4.jpg,378000.0
sasangkala ORIGINAL Jaket Gunung Salewa - Toble 2.0 Polarlite,https://images.tokopedia.net/img/cache/200-square/hDjmkQ/2021/10/30/c8b54213-8f63-4780-b258-d833db14f6da.jpg,298000.0
Salewa Outdoor Waterproof Jacket,https://images.tokopedia.net/img/cache/200-square/VqbcmM/2022/12/21/b9cdad9c-85ea-47ff-8216-836372f76279.jpg,350000.0
Jacket Salewa Gore-Tex,https://images.tokopedia.net/img/cache/200-square/VqbcmM/2022/1/29/1b50075d-c47c-4c1c-8a5b-b878d290febc.jpg,380000.0
jaket salewa outdoor second size M,https://images.tokopedia.net/img/cache/200-square/hDjmkQ/2023/1/7/3599bd56-8f39-40fa-84cc-c8f862de653c.jpg,222000.0
sasangkala ORIGINAL Inner Jacket Salewa - Buffalo 3.0,https://images.tokopedia.net/img/cache/200-square/hDjmkQ/2021/11/6/fc7c1ce1-0e7b-48d5-ab75-1d9c04de6991.jpg,382000.0
jaket outdoor second salewa size Lke xl,https://images.tokopedia.net/img/cache/200-square/VqbcmM/2022/4/16/063da580-ba4d-4d90-a442-92e3d53a3119.jpg,200000.0
jaket musim dingin half zip salewa original fleece not rab tnf jws rei,https://images.tokopedia.net/img/cache/200-square/VqbcmM/2021/8/25/31e20d1e-f237-4be0-83b9-218545455156.jpg,144000.0
SALEWA FUEZ HERITAGE FLEECE JACKET ORIGINAL SIZE M MENS NEW ,https://images.tokopedia.net/img/cache/200-square/product-1/2018/1/6/5392334/5392334_a7ee3e5b-568c-418d-871f-16a71b0650d8_750_1082.jpg,650000.0
Patagonia Tracksuit Jacket Original No TNF Marmott MHW Millet Salewa,https://images.tokopedia.net/img/cache/200-square/VqbcmM/2021/5/10/a40e64f3-ff63-4126-a158-b487d2c3dea9.jpg,155000.0
Jaket Gunung Trespass DLX Not Eiger Salewa Osprey TNF Columbia K2,https://images.tokopedia.net/img/cache/200-square/VqbcmM/2021/4/3/2164436f-81cd-41e6-a8cb-067bc7c2e563.jpg,1125000.0
Jaket Gunung SALEWA DICKIES M-XL Hoodie Outdoor Hiking Waterproof 2nd,https://images.tokopedia.net/img/cache/200-square/VqbcmM/2022/8/1/ee183413-5a89-4a78-acc2-8bd75b5ca4eb.jpg,206700.0
Jaket Outdoor Salewa (SOLD),https://images.tokopedia.net/img/cache/200-square/VqbcmM/2021/6/3/45e87ce8-a935-4fdd-90e0-c8f00d96fd24.jpg,255000.0
jaket salewa,https://images.tokopedia.net/img/cache/200-square/VqbcmM/2022/10/4/d3ced9e9-5228-423f-8f1d-135f07294ce7.jpg,250000.0
Terbaru..!! Jaket Gunung Trespass DLX Not Eiger Salewa Osprey TNF,https://images.tokopedia.net/img/cache/200-square/product-1/2020/10/23/inv/inv_bd9d00ff-54a1-4a96-9ad6-d769893f2639_574_574.jpg,975000.0
Jaket Salewa Running Putih,https://images.tokopedia.net/img/cache/200-square/VqbcmM/2021/11/28/18981275-64f5-42d9-b657-d8a770d17826.jpg,75000.0
jaket salewa,https://images.tokopedia.net/img/cache/200-square/VqbcmM/2022/7/5/dc9cfcaf-b224-4468-8c71-e3f29510117c.jpg,125000.0
Jaket Outdoor Salewa for Women,https://images.tokopedia.net/img/cache/200-square/VqbcmM/2022/5/15/87b603e5-8718-44f0-913a-f41f7aaeafe1.jpg,115000.0
Jaket Casual Salewa Outdoor Equipment Second Tracking Sepeda Hiking,https://images.tokopedia.net/img/cache/200-square/VqbcmM/2022/2/8/02ff526a-3639-4d92-8851-926cd7c0a5d4.jpg,70000.0
paket jaket outdoor dan tipis salewa,https://images.tokopedia.net/img/cache/200-square/VqbcmM/2023/1/25/2bbab49c-c2eb-46cb-b4ed-c9a005d0dc06.jpg,70000.0
SALEWA FUEZ HERITAGE FLEECE JACKET ORIGINAL SIZE M MENS NEW ,https://images.tokopedia.net/img/cache/200-square/product-1/2018/1/6/5392334/5392334_f597b15a-23b7-4249-a8ea-c6fc9e162ce7_750_1082.jpg,650000.0
SALEWA Outdoor Zipper Blue Tosca Second / Jaket Gunung Salewa Second,https://images.tokopedia.net/img/cache/200-square/VqbcmM/2021/1/27/67c8a206-ed9a-40b6-a0bc-54d5f8e76c9c.jpg,120000.0
jaket salewa windstoper,https://images.tokopedia.net/img/cache/200-square/VqbcmM/2022/12/13/77977012-66e2-4bf1-a412-7653be3aade6.jpg,200000.0
Jacket millet serpy Down Not Tnf Not salewa not jws not berghaus,https://images.tokopedia.net/img/cache/200-square/VqbcmM/2022/11/21/04fd899c-223f-4ef5-acf2-0722c5740543.jpg,725000.0
JAKET SALEWA,https://images.tokopedia.net/img/cache/200-square/VqbcmM/2022/7/23/b285e6cf-8ca3-4405-bf77-260c44e11f89.jpg,180000.0
JAKET SOFTSHELL PEAK PERFORMANCE BUKAN MAMMUT RAB EIGER TNF SALEWA,https://images.tokopedia.net/img/cache/200-square/VqbcmM/2020/11/22/11e95195-7693-4148-9bf2-4f5609f02f79.jpg,185000.0
Salewa Goretex XCR jaket outdoor waterproof size M second,https://images.tokopedia.net/img/cache/200-square/VqbcmM/2023/1/23/c6c5f7d5-0ade-49a0-8eca-36648e92c5ea.jpg,150000.0
Jaket Polar Salewa pria wanita / Jaket Gunung Polartec Salewa Original,https://images.tokopedia.net/img/cache/200-square/VqbcmM/2022/11/14/ea2a80cc-1649-4586-98f5-d599010a3ab7.jpg,117000.0
Jaket salewa goretex,https://images.tokopedia.net/img/cache/200-square/VqbcmM/2020/12/16/dc5cce8b-5965-409c-82f0-0dfb55e310f6.jpg,450000.0
Jaket Salewa Buffalo not eiger consina arcteryx tnf berghaus mhw,https://images.tokopedia.net/img/cache/200-square/VqbcmM/2022/2/10/987f5002-7650-434f-bb6a-cf28b1343b63.jpg,500000.0
JAKET INNER POLAR FLEECE SALEWA 2,https://images.tokopedia.net/img/cache/200-square/VqbcmM/2021/10/6/fff422bc-c689-42f7-811b-ca6ff7926644.png,114750.0
Jaket Windstopper Salewa Women Seken,https://images.tokopedia.net/img/cache/200-square/VqbcmM/2020/10/22/f55d71fb-3282-4164-8606-0bef5e75bb49.jpg,90000.0
jaket outdoor tracking waterproof goretex SALEWA 2nd bkn tnf jws,https://images.tokopedia.net/img/cache/200-square/product-1/2017/3/20/1581698/1581698_55470452-cf55-4fcd-a901-4a5e88f98b36.jpg,275000.0
Jaket Gunung Montbell Salewa Trespass Columbia K2 TNF Eiger Deuter,https://images.tokopedia.net/img/cache/200-square/VqbcmM/2022/7/23/e5edf711-d90c-4442-aa49-8fd4f251b403.jpg,1410000.0
jaket tnf keeru jacket rare not berghaus salewa napapijri salomon or,https://images.tokopedia.net/img/cache/200-square/product-1/2019/7/6/837772/837772_467b86b8-9306-4a9b-a3e8-6ac976b9c3e0_720_720.jpg,850000.0
JAKET SALEWA CASNAGO FULL ZIP HOODIE ORIGINAL NOT TNF RAB MAMMUT,https://images.tokopedia.net/img/cache/200-square/VqbcmM/2021/9/15/16ba5baa-972e-456e-921e-11f6c03e761a.jpg,497000.0
JAKET INNER POLAR FLEECE SALEWA 1,https://images.tokopedia.net/img/cache/200-square/VqbcmM/2021/10/6/f4409aa8-bd26-45f7-b4aa-9bb977c285da.png,165750.0
Jacket Salewa Goretex,https://images.tokopedia.net/img/cache/200-square/product-1/2020/3/13/20528581/20528581_6a36f941-6c26-452d-91a7-93dc57a3d9db_1620_1620,350000.0
jaket uniqlo ultralight extra warm not rab fjallraven salewa lafu,https://images.tokopedia.net/img/cache/200-square/product-1/2019/11/12/batch-upload/batch-upload_3e6960ea-b0c9-478a-8689-0463fb09273b.png,396000.0
jaket salewa Tonle 2.0 polarlite jaket outdoor big size,https://images.tokopedia.net/img/cache/200-square/product-1/2019/5/14/472673959/472673959_99d39535-d59e-4315-981c-47abd07aab04_569_569.jpg,199000.0
Terbaru..!! Jaket Running Atau Sepeda Not Eiger Salewa Salomon Osprey,https://images.tokopedia.net/img/cache/200-square/product-1/2020/10/23/inv/inv_1d993f2e-5c12-4034-a7ff-32ce7ef16b69_428_428.jpg,260000.0
Baselayer Sweater Fleece Jaket Gunung Salewa Alpine Xtrem Size M Women,https://images.tokopedia.net/img/cache/200-square/hDjmkQ/2023/1/24/0c8380cf-b9e9-4f1e-b4d3-cee7c5af9887.jpg,222800.0
JAKET SALEWA PRO ALPINEXTREM POLARTEC POWER STRETCH ORIGINAL,https://images.tokopedia.net/img/cache/200-square/VqbcmM/2022/9/9/183dee48-b86e-4534-9cc2-41aaded2404b.jpg,350000.0
Salewa Ortles 2 Ptc Mf Fleece Mens Jaket Outdoor Blue Best Product,https://images.tokopedia.net/img/cache/200-square/VqbcmM/2023/1/24/2bfe376b-11ac-469b-8103-bb7c10ffa13b.jpg,365000.0
jaket salewa original outdoor,https://images.tokopedia.net/img/cache/200-square/VqbcmM/2021/2/13/9033155a-f4ac-45f4-8358-2fab1dfc5093.jpg,230000.0
JACKET POLAR / INER BRAND SALEWA MURAH,https://images.tokopedia.net/img/cache/200-square/hDjmkQ/2023/1/23/f93dace9-1f10-4ef5-8cfb-0442e5052659.jpg,126000.0
Napapijri Medium Jaket Everest not tnf salewa berghaus rab arcteryx,https://images.tokopedia.net/img/cache/200-square/VqbcmM/2022/7/12/2181d72a-1672-441c-b409-ed12c2e1b0d7.jpg,1350000.0
Fashion415 - Jaket Outdoor 3Layer 3Premium Salewa Original Goretex,https://images.tokopedia.net/img/cache/200-square/VqbcmM/2022/6/26/a6b67074-5470-4468-9e41-e95d485a6a37.jpg,462000.0
JAKET GUNUNG EIDER NOT SALEWA TNF MHW EIGER CONSINA REI,https://images.tokopedia.net/img/cache/200-square/product-1/2019/11/13/batch-upload/batch-upload_f163530c-a06a-494e-b69e-b24a1123a21b.png,147000.0
Jaket Salewa Polartec Half Zip Outdoor Hiking Gunung Travel Ultralight,https://images.tokopedia.net/img/cache/200-square/product-1/2019/4/29/1066815/1066815_6d9434f1-2adf-4ddb-8d55-8e2e08cacfcf_1046_1046.jpg,145000.0
Jaket Outdoor Gunung Salewa 014,https://images.tokopedia.net/img/cache/200-square/VqbcmM/2022/9/7/f7a2a5a1-8a6a-4d6e-81fa-5cad0853579e.jpg,180000.0
jaket musim dingin anak jaket tnf anak hooded not salewa millet berg,https://images.tokopedia.net/img/cache/200-square/product-1/2019/5/17/59440718/59440718_81b24cf7-fba5-4606-94cd-e660f1bfa9f1_700_700.jpg,399800.0
Jaket Gunung DICKIES SALEWA BLACKYAK size M-XL Hoodie Outdoor Hiking,https://images.tokopedia.net/img/cache/200-square/hDjmkQ/2023/1/4/340650ad-fca2-4f70-8422-df702a404496.jpg,268700.0
