name,image_url,price
L'Oreal Paris Extraordinary Oil Gold,https://images.tokopedia.net/img/cache/200-square/VqbcmM/2022/11/8/a62f4089-d928-42b6-9ed1-07d7920d54b7.jpg,93500.0
Loreal Excellence Fashion 9.11 Silver Ash Pewarna Rambut Loreal,https://images.tokopedia.net/img/cache/200-square/VqbcmM/2022/2/18/1c116551-b6b2-4d77-b42a-ab361b2a0bf0.jpg,129800.0
Loreal Profesional Mythic Oil Huile Originale Nourishing Oil - Lr.f,https://images.tokopedia.net/img/cache/200-square/VqbcmM/2021/9/23/5e16548b-a1a1-4a12-8de8-8332f65426c8.jpg,154999.0
Loreal Excellence Creme 03 Dark Brown - Cat Rambut Loreal,https://images.tokopedia.net/img/cache/200-square/VqbcmM/2020/9/30/e0c54b5c-de0e-4fcf-a6bf-619e6253900e.jpg,109800.0
Loreal Hair Spa Deep Nourishing Creambath 500 ml / Masker Rambut 500ml,https://images.tokopedia.net/img/cache/200-square/VqbcmM/2021/4/28/7acb4371-394f-4dbb-a730-e6ed21321005.jpg,89000.0
Loreal Shampoo Elseve Hair Care Fall Resist 3x- 620ml 620ml,https://images.tokopedia.net/img/cache/200-square/VqbcmM/2021/12/13/ec7bab04-e4dd-44ac-99dc-9a44c10e007a.jpg,69500.0
L'Oreal Paris Fall Resist 3X Anti Hair-Fall Shampoo,https://images.tokopedia.net/img/cache/200-square/VqbcmM/2022/9/5/d25d95e4-e3f9-4036-b134-cb0ecd0935e7.jpg,41400.0
PROMO! LOREAL Serioxyl Denser Hair Serum 90ml,https://images.tokopedia.net/img/cache/200-square/VqbcmM/2022/2/27/2a777f7a-ed13-41aa-95e0-148385c5abb4.png,288000.0
Loreal scalp Re balancing Scrub hair spa ice hairspa rambut ketombe,https://images.tokopedia.net/img/cache/200-square/VqbcmM/2022/6/14/63229535-469c-40c6-b91f-0d6ae9853f86.jpg,81998.0
Loreal Excellence Creme No 4 Brown - Cat Rambut Loreal,https://images.tokopedia.net/img/cache/200-square/product-1/2020/7/8/663593269/663593269_40727ee4-4370-44e6-82d9-b6e09cfe7a2a_1080_1080.jpg,105800.0
L'Oreal Paris Glycolic Acid Bright Day Cream SPF17 + Night Cream 15ml,https://images.tokopedia.net/img/cache/200-square/VqbcmM/2023/1/4/ffe38f7c-427f-4a58-9f56-002ec64f3d96.jpg,114000.0
L'Oreal Paris Men Expert Pure &Matte Charcoal Black Foam Icy Twinpack,https://images.tokopedia.net/img/cache/200-square/VqbcmM/2022/12/5/f55ea9d2-1b7e-4905-ac8c-d60ccd59a5a8.jpg,72800.0
L'Oreal Paris Excellence Fashion Cat Rambut,https://images.tokopedia.net/img/cache/200-square/VqbcmM/2022/9/18/ffbed5fb-6253-4970-ac6f-0447a2cd5449.jpg,119250.0
LOREAL Excellence Creme Pewarna rambut triple care color,https://images.tokopedia.net/img/cache/200-square/VqbcmM/2021/9/3/9f10cb1a-fd0f-4ab7-8a86-530c1f751b7b.jpg,104900.0
Loreal Excellence Creme Hair Color Triple Care/Cat-Pewarna Rambut,https://images.tokopedia.net/img/cache/200-square/VqbcmM/2022/5/27/56429b51-6385-45e4-9a26-c2387d52536f.jpg,99950.0
L'Oreal Paris Fall Resist 3X Anti Hair-Fall Shampoo 650 ml,https://images.tokopedia.net/img/cache/200-square/VqbcmM/2021/6/11/d97bc0c3-2e06-42a8-a26d-df87060df0c8.jpg,69000.0
loreal elseve extraordinary oil hair,https://images.tokopedia.net/img/cache/200-square/VqbcmM/2022/12/19/f2db68fd-d077-440d-a142-7b957a73f312.jpg,96999.0
Loreal Serie Expert Silver Shampoo Conditioner Set Rambut Bleaching,https://images.tokopedia.net/img/cache/200-square/VqbcmM/2022/7/22/213d1064-9def-4db8-9d4a-7854ab675bd8.jpg,120000.0
LOREAL Paris Excellence Creme Hair Color - Cat Pewarna Semir Rambut,https://images.tokopedia.net/img/cache/200-square/VqbcmM/2022/6/23/dde139a3-bc0e-4c23-9704-f969c257e391.jpg,97500.0
loreal hairspa shampoo 600ml l'oreal hair spa shampo 600 ml deep dx,https://images.tokopedia.net/img/cache/200-square/VqbcmM/2021/7/30/b97fa253-df8d-4f41-ae95-6878a4116178.jpg,99423.0
L'Oreal Paris Excellence Ash Supreme,https://images.tokopedia.net/img/cache/200-square/VqbcmM/2022/9/18/bc5334bf-1fa6-45b3-a289-45454df075d6.jpg,119250.0
L'Oreal Paris Total Repair 5 Shampoo,https://images.tokopedia.net/img/cache/200-square/VqbcmM/2022/9/5/d4ee6fdc-5ec3-4077-af45-e49364a9f22a.jpg,41400.0
L'OREAL PARIS Fall Resist 3x Anti Hair Fall Shampoo 620ml,https://images.tokopedia.net/img/cache/200-square/VqbcmM/2021/12/14/af7471c6-09fd-453c-9766-2890bc437e14.jpg,65999.0
LOREAL Serie Expert Vitamino Color Shampoo Conditioner Set,https://images.tokopedia.net/img/cache/200-square/VqbcmM/2022/2/2/eb676bb9-d58b-44e2-bbfa-5afed1bf2c04.png,260000.0
Loreal Paris Excellence creme,https://images.tokopedia.net/img/cache/200-square/VqbcmM/2020/12/17/b6846019-cd05-4354-966b-c093208c0162.jpg,90000.0
L'Oreal Paris Hair Care Extraordinary Oil Ultra Nourish Shampoo,https://images.tokopedia.net/img/cache/200-square/VqbcmM/2022/9/5/c4ba66d8-b6fe-45cd-b311-38e334d69fdc.jpg,101000.0
L'Oreal Paris Fall Resist 3X Anti Hair-Fall Shampoo 620 mL Twinpack,https://images.tokopedia.net/img/cache/200-square/VqbcmM/2022/11/24/548d7cbe-6b76-469f-98dc-672804d481e3.jpg,234000.0
(New) L'oreal Extraordinary Oil Gold 100 ml Hair Serum,https://images.tokopedia.net/img/cache/200-square/VqbcmM/2021/9/19/2c371ecb-b110-45ca-b569-7c68c02e4297.jpg,94000.0
Loreal Serie Expert Vitamino Color Shampoo Conditioner Hair Mask Set,https://images.tokopedia.net/img/cache/200-square/VqbcmM/2022/12/1/e4f9dee2-2b66-4425-8469-b8e2d6999d6c.jpg,118000.0
Loreal Silver Shampoo 300ml,https://images.tokopedia.net/img/cache/200-square/VqbcmM/2022/12/6/2bd6dda4-5c54-4392-85d4-1f03a91eb529.jpg,114000.0
Loreal Excellence Hair Color Fashion-Ash Supreme/Creme/Ultra Lights,https://images.tokopedia.net/img/cache/200-square/VqbcmM/2022/8/18/f57051ce-6480-4142-b69c-5872344b1d3a.jpg,99950.0
Loreal Paris Excellence Bleach Supreme,https://images.tokopedia.net/img/cache/200-square/hDjmkQ/2023/1/20/a4be4ea4-b9a7-41a2-9074-8e1276488ca8.jpg,108000.0
LOREAL Cat Rambut Majibrown 50ml,https://images.tokopedia.net/img/cache/200-square/VqbcmM/2020/9/14/b8fbf180-7014-4f63-890b-a60eaa6cd2dd.jpg,84000.0
Loreal Paris Excellence Creme Hair Color - # 3 Dark Brown,https://images.tokopedia.net/img/cache/200-square/VqbcmM/2022/11/7/a97a9f93-b6e6-45eb-b90b-1fb4bff691f1.jpg,104500.0
Dia richesse - Loreal,https://images.tokopedia.net/img/cache/200-square/VqbcmM/2022/2/22/36b65430-0ed6-4c93-b137-ac3a91f539fe.jpg,79000.0
L'Oreal Paris Men Expert Vitalift Foam - 100ml,https://images.tokopedia.net/img/cache/200-square/VqbcmM/2022/8/18/e6aac810-38ae-45f5-8fec-677a58ad2079.jpg,63000.0
Loreal hair spa shampoo loreal hairspa shampo l'oreal 1500ml 1.5 liter,https://images.tokopedia.net/img/cache/200-square/VqbcmM/2021/6/15/eaed01af-dd1c-4e97-a8b2-ebea2c64e784.jpg,159999.0
Loreal Oxidant mini 6. 9%,https://images.tokopedia.net/img/cache/200-square/product-1/2018/3/26/0/0_828bea23-2e9e-447d-bc4d-80e90321cc8e_581_1032.jpg,23000.0
Loreal Hair Color - Loreal Paris Excellence Creme - Cat Pewarna Rambut,https://images.tokopedia.net/img/cache/200-square/VqbcmM/2022/10/21/3c71d451-8baf-4753-8c1a-e02f8f10a3da.jpg,113500.0
Loreal Paris Elseve Fall Resist / Total Repair 620 ml 620ml shampoo,https://images.tokopedia.net/img/cache/200-square/VqbcmM/2021/12/2/38a70018-7d62-440d-a4c2-041bad3947b7.jpg,69900.0
Loreal Excellence Creme No 5 Light Brown - Cat Rambut Loreal,https://images.tokopedia.net/img/cache/200-square/product-1/2020/7/8/588308616/588308616_92875d4c-92ad-4cbc-9c36-8a2a7e903743_1080_1080.jpg,109800.0
LOREAL Cat Rambut Toning dia riecies 50ml,https://images.tokopedia.net/img/cache/200-square/VqbcmM/2020/9/14/0e003f5d-1960-4ace-9a90-17fb32ddbc12.jpg,76000.0
L'Oreal Paris Excellence Crème Hair Color Cat Rambut,https://images.tokopedia.net/img/cache/200-square/VqbcmM/2022/9/5/189c69d3-1905-4e19-a1aa-4e141d763772.jpg,108750.0
Loreal Extraordinary Oil Hair Serum 100 ml,https://images.tokopedia.net/img/cache/200-square/VqbcmM/2022/9/24/01514d79-8e9d-44e3-a962-602de4e074e5.jpg,94000.0
Loreal Professionnel Serie Expert Keratin Liss Unlimited Shampoo Hair,https://images.tokopedia.net/img/cache/200-square/VqbcmM/2022/8/9/bf39203e-1e1c-4d41-bb27-b306e7bca7b2.jpg,120000.0
LOREAL Shampo Hair Spa Nourishing & DX 1500ml,https://images.tokopedia.net/img/cache/200-square/product-1/2019/2/22/3185418/3185418_42a25c83-0a39-49c0-87fb-006a1929ce91_640_640.jpg,165000.0
Serie Expert Density Advance Shampoo 300ml LOREAL,https://images.tokopedia.net/img/cache/200-square/VqbcmM/2022/12/6/165fdf1e-1891-4701-8fa0-41068ac2d85f.jpg,111000.0
L'OREAL ELSEVE COLOR VIVE SHAMPOO 170 ML / SHAMPOO RAMBUT BERWARNA /,https://images.tokopedia.net/img/cache/200-square/VqbcmM/2020/11/10/cb42b79f-ce66-4a07-808a-77df36399366.jpg,42113.0
Loreal Serie Expert Absolut Repair Shampoo Conditioner Hair Mask Serum,https://images.tokopedia.net/img/cache/200-square/VqbcmM/2022/9/10/3ba6e317-4773-420d-8ce2-3d098133c24a.png,120000.0
Loreal Shampoo/Hairspa Deep Nourishing/ Dx Shampoo 1.5ltr - LR.B,https://images.tokopedia.net/img/cache/200-square/product-1/2020/2/2/7397322/7397322_6d9e0d39-9514-4748-a818-7dc568e3af66_554_554.jpg,158999.0
"Loreal Oxydant 1000ml (6%,9%,12%)",https://images.tokopedia.net/img/cache/200-square/VqbcmM/2021/11/8/00d54657-e6f6-43c5-b963-6df6b239275b.jpg,135000.0
Loreal Paris Excellence Creme Hair Color Fashion Ash Pewarna Rambut,https://images.tokopedia.net/img/cache/200-square/VqbcmM/2022/9/28/512c4957-4146-4a79-b182-e7d978d639e0.jpg,109900.0
Loreal Paris Excellence Creme Hair Color Cat Pewarna Rambut Permanen,https://images.tokopedia.net/img/cache/200-square/VqbcmM/2022/11/24/a19c0b88-6021-4767-a9ed-525027a922c2.jpg,114900.0
LOREAL SERIE EXPERT PURE RESOURCE SHAMPOO 300 ml,https://images.tokopedia.net/img/cache/200-square/VqbcmM/2022/3/5/22de6bd2-6958-4f7d-aa38-f81f0617229d.jpg,110000.0
L'Oreal Paris ELSEVE Hyaluron Moisture Shampoo + Conditioner 280 mL,https://images.tokopedia.net/img/cache/200-square/VqbcmM/2023/1/9/fd7e7ab4-dda5-4782-abc3-d62316e949ec.jpg,142200.0
loreal Serie Expert Vitamino Colour Shampoo 300ml,https://images.tokopedia.net/img/cache/200-square/VqbcmM/2022/12/6/a29b984f-589e-4b5f-ad71-fadc8cbb7211.jpg,111000.0
Loreal Excellence Fashion 7.17 Matt Ash Pewarna Rambut Loreal,https://images.tokopedia.net/img/cache/200-square/VqbcmM/2022/3/11/4eba269f-c91c-4518-b219-e45490a27f34.jpg,129800.0
Loreal Paris Total Repair 5 Shampoo Hair Care 650 ml,https://images.tokopedia.net/img/cache/200-square/VqbcmM/2020/7/5/b3c3c615-3b43-4d02-8b49-c58af9f41fa0.jpg,51499.0
Loreal Excellence Ash Supreme 6.11 Smoky Ash - Pewarna Rambut L'Oreal,https://images.tokopedia.net/img/cache/200-square/hDjmkQ/2023/1/21/422566a9-b83a-4c81-b272-d87dd8ceabdd.jpg,129800.0
L'Oreal Paris Total Repair 5 Shampoo 650 ml,https://images.tokopedia.net/img/cache/200-square/VqbcmM/2022/5/11/b1d6ba7d-3132-4641-8a8d-e1258f9f9e3f.jpg,67500.0
LOREAL Paris Fall Resist 3x Shampoo Hair Care - 650 ml,https://images.tokopedia.net/img/cache/200-square/VqbcmM/2022/8/27/2943289c-1d17-4914-89a5-a2a5e384c326.jpg,70000.0
Loreal Paris Excellent Dark Brown Cat Rambut / Cat Rambut Loreal,https://images.tokopedia.net/img/cache/200-square/VqbcmM/2022/2/3/b773e3f1-38bf-4f19-b5a1-44d44233f0a3.jpg,100150.0
L'OREAL Elseve Extraordinary Oil Ultra Nourishing Shampoo 450ml,https://images.tokopedia.net/img/cache/200-square/VqbcmM/2022/6/15/57b45eac-c49c-4769-bb4a-1af8f970e360.jpg,80500.0
Loreal Excellence Creme 5.35 Chocolate Brown - Cat Rambut Loreal,https://images.tokopedia.net/img/cache/200-square/VqbcmM/2020/9/8/27c798db-d46e-40d3-9bc9-1fa8cb33ddaa.jpg,109800.0
Loreal Serie Expert Sensi Balance Shampoo for Sensitive Scalp 300ml,https://images.tokopedia.net/img/cache/200-square/VqbcmM/2022/12/6/0e7ef00d-eba2-4145-8e2e-ec6ef27b69fa.jpg,111000.0
Loreal Paris Excellence Creme hair color Dark Brown no 3,https://images.tokopedia.net/img/cache/200-square/VqbcmM/2021/12/29/104c142d-4259-41ef-9887-636ecbf39801.jpg,99500.0
L'Oreal Paris Fall Resist Hair Mask - Masker Rambut,https://images.tokopedia.net/img/cache/200-square/VqbcmM/2022/8/18/da8bd116-38f8-4166-af8f-a3363948a889.jpg,72000.0
L'OREAL ELSEVE COLOR VIVE SHAMPOO 170 ML / SHAMPOO RAMBUT BERWARNA /,https://images.tokopedia.net/img/cache/200-square/hDjmkQ/2022/1/26/e8c2406c-ae97-406c-ace4-a6927aacd52c.jpg,38851.0
Loreal PARIS Excellance Fasion Hair Color Light Ash Pewarna Rambut,https://images.tokopedia.net/img/cache/200-square/VqbcmM/2021/7/22/7ec0bf32-f0a3-45ea-856b-94d5f1bd5774.jpg,129900.0
L'Oreal Paris Revitalift Krim Anti-Aging Day + Night Cream,https://images.tokopedia.net/img/cache/200-square/VqbcmM/2023/1/24/6899941e-55d4-4cf6-b080-e9a3e093e4a1.jpg,299000.0
L'Oreal Excellence Hair Color Creme 3 Natural Dark Brown,https://images.tokopedia.net/img/cache/200-square/VqbcmM/2021/11/26/578be446-9735-45e9-afb2-ad340f4af128.jpg,99500.0
Loreal Hair Color Excellence Ultra Light Natural Brown 01,https://images.tokopedia.net/img/cache/200-square/VqbcmM/2022/9/24/c2fd5611-43e5-468f-b048-1a4f92f4520e.jpg,84999.0
L'Oreal Hair Extraordinary Oil 100gr,https://images.tokopedia.net/img/cache/200-square/VqbcmM/2022/9/29/679b7408-bc09-43b3-bfc8-e7f53546de10.jpg,135900.0
L'Oreal Paris Color-Vive Protecting Shampoo 280ml,https://images.tokopedia.net/img/cache/200-square/VqbcmM/2022/5/11/a6701be1-2140-48ab-a3c5-3be6ea65d88c.jpg,58900.0
LOREAL PARIS Excellence Creme Fashion Hair Color Pewarna Rambut,https://images.tokopedia.net/img/cache/200-square/VqbcmM/2022/9/28/35b2b0d5-2add-416a-ba84-dea6e8f008d1.jpg,105900.0
majirel No.1. ( Black ). - Loreal. coloring,https://images.tokopedia.net/img/cache/200-square/VqbcmM/2022/2/22/71be7534-050c-437d-a71b-5fb4a4760a92.jpg,23700.0
LOREAL SERIE EXPERT INSTAN CLEAR ANTI DANDRUFF KETOMBE SHAMPOO 300ML,https://images.tokopedia.net/img/cache/200-square/VqbcmM/2022/3/8/d9403bb1-197c-4f57-8b3b-abd187f7f503.jpg,120154.0
Loreal majirel maji fashion 7.1 ash blonde hair color cat rambut,https://images.tokopedia.net/img/cache/200-square/VqbcmM/2022/1/20/891ec684-35a4-4e2a-9b98-5e23f62a594f.jpg,99900.0
loreal oxydant cream 6% 75ml,https://images.tokopedia.net/img/cache/200-square/VqbcmM/2020/10/25/72013102-87af-4615-80a7-4f4c20a4a5b0.jpg,24900.0
L'Oreal Paris Glycolic Acid Bright Foam,https://images.tokopedia.net/img/cache/200-square/VqbcmM/2022/8/18/07ad5a2c-f527-4722-a0ba-bc0d78760b4f.jpg,45000.0
Loreal Excellence Creme No 1 Black - Cat Rambut Loreal,https://images.tokopedia.net/img/cache/200-square/product-1/2020/5/20/564014507/564014507_fa649c66-7df6-46e5-95ad-bce096314cb3_1080_1080.jpg,105800.0
L'Oreal Color Protecting Shampoo 180ml,https://images.tokopedia.net/img/cache/200-square/VqbcmM/2023/1/12/e88d1c22-5022-4f1f-89b4-2631639fc983.jpg,44000.0
Loreal Kids Extra Gentle 2 in 1 Swim & Sport Shampoo,https://images.tokopedia.net/img/cache/200-square/product-1/2016/5/14/220123/220123_514d92e6-f970-4c94-bcf0-d9dd499f4793.jpg,109999.0
L'Oreal Paris Total Repair 5 Shampoo 620 mL Twinpack,https://images.tokopedia.net/img/cache/200-square/VqbcmM/2022/11/28/822701a5-22ee-4bf8-966b-ec37d603f348.jpg,140400.0
Loreal Elseve Color Protecting Shampoo 330 ml + Conditioner 160ml,https://images.tokopedia.net/img/cache/200-square/VqbcmM/2021/8/26/375fe5cd-87b9-4bb7-b12d-aa115c7c9618.jpg,100000.0
L'Oreal Paris Fall Resist 3x Anti Hair Fall Shampoo 650ml,https://images.tokopedia.net/img/cache/200-square/VqbcmM/2022/6/7/c82f5997-11c7-45cd-b899-ce223a84a19f.jpg,67000.0
Loreal Paris Excellence Cream Hair Color Pewarna Rambut,https://images.tokopedia.net/img/cache/200-square/VqbcmM/2022/8/29/18930ca6-07fd-4fb2-8542-7780c72f3054.jpg,105000.0
L'Oreal Professionnel Hair Spa DX Shampoo - Kulit Kepala Berminyak,https://images.tokopedia.net/img/cache/200-square/VqbcmM/2022/10/14/1cdcd51f-d46a-4757-9edb-97f41904d556.jpg,87900.0
Loreal Excellence Fashion Ultra Lights 03 Ash Brown Cat Rambut Loreal,https://images.tokopedia.net/img/cache/200-square/VqbcmM/2022/1/30/7494bfef-e43e-4f19-9655-0cfe2dc0d97b.jpg,125800.0
L'Oreal Paris Excellence Ash Supreme Twinpack,https://images.tokopedia.net/img/cache/200-square/VqbcmM/2022/11/25/b09db926-5ed4-417a-8183-0b36d31eca1a.jpg,206700.0
Loreal MAJIREL 50ml ( HANYA DiSiNi stock warna paling lengkap ),https://images.tokopedia.net/img/cache/200-square/VqbcmM/2020/9/5/13ea0495-9263-4c34-a675-3320e574bc41.jpg,91000.0
Loreal Facial Cleanser Foam/Scrub 100 ml-Aura/White Perfect-Revitalift,https://images.tokopedia.net/img/cache/200-square/VqbcmM/2022/6/1/8bee1ef9-2519-4eeb-a412-03608d097e4f.jpg,44950.0
LOREAL CAT RAMBUT EXELLENCE WARNA LENGKAP,https://images.tokopedia.net/img/cache/200-square/VqbcmM/2022/3/30/ed57af6d-3bfb-45e7-af62-34cfdfd302be.jpg,98500.0
Loreal elseve color protect shampo 280,https://images.tokopedia.net/img/cache/200-square/VqbcmM/2022/7/15/741dc670-1119-431d-8a44-5ade1c887797.jpg,36400.0
Silver Magnesium Shampo Serie Expert - Loreal Profesional,https://images.tokopedia.net/img/cache/200-square/VqbcmM/2021/4/8/be602228-5a2a-45fd-8ea9-9c470504d5e1.jpg,125700.0
LOREAL Hair Spa Detox DX Shampoo Kulit Kepala Rambut Berminyak Gatal,https://images.tokopedia.net/img/cache/200-square/VqbcmM/2022/2/2/322fd3b1-ee95-4333-b4fe-cc08bebff194.png,60000.0
Loreal Paris EverPure Purple Shampoo Hibiscus 200ml,https://images.tokopedia.net/img/cache/200-square/VqbcmM/2021/2/17/ad43d343-a486-4e37-9495-a6d70df14989.jpg,276000.0
Loreal Glycolic Acid Bright Day Night Cream SPF 17 Krim Skincare Wajah,https://images.tokopedia.net/img/cache/200-square/VqbcmM/2023/1/4/c952e63e-4b20-4fe2-900b-9859cfacbb56.jpg,66900.0
L'Oreal Professionnel Hair Spa DX Shampoo 600ml,https://images.tokopedia.net/img/cache/200-square/VqbcmM/2022/10/14/8f9cdbaa-3785-4a75-850e-0184fcf545ba.jpg,139200.0
"loreal paris excellence creme hair color#purple brown 4,26",https://images.tokopedia.net/img/cache/200-square/VqbcmM/2022/10/17/3f69c8a1-19ab-4a4a-8561-c6e13cf07b74.jpg,105500.0
cat rambut loreal semir uban L'Oreal excellent,https://images.tokopedia.net/img/cache/200-square/VqbcmM/2022/1/14/ddbc8a60-3786-4fb0-9768-df77da8841d7.jpg,105000.0
loreal hair spa deep nourishing shampoo 1500ml,https://images.tokopedia.net/img/cache/200-square/product-1/2019/3/16/2425395/2425395_e4110e35-a02c-47ae-bf02-031b4d53636a_700_700.jpg,160000.0
Loreal Hair Spa Deep Nourishing Shampoo 600ml,https://images.tokopedia.net/img/cache/200-square/VqbcmM/2021/9/30/2fd80d35-15ba-4a64-81b8-26e9ad395268.jpg,92400.0
Loreal Total Repair 5 Hair Mask,https://images.tokopedia.net/img/cache/200-square/VqbcmM/2022/8/27/93a073ea-bb70-4077-8474-78a365c20056.jpg,63500.0
L'Oreal Paris Glycolic Acid Night Cream,https://images.tokopedia.net/img/cache/200-square/VqbcmM/2022/8/18/78225d92-b774-44f0-8dd8-825d5b647ba9.jpg,68400.0
LOREAL HAIRSPA SHAMPOO 250ml HAIR SPA DX DEEP NOURISHING SHAMPO 250 ML,https://images.tokopedia.net/img/cache/200-square/VqbcmM/2022/9/12/b8426642-05a0-4489-8eec-69c4e4300d3d.jpg,56373.0
L'Oreal Paris Color-Vive Protecting Shampoo 330ml,https://images.tokopedia.net/img/cache/200-square/VqbcmM/2022/5/11/49a917bb-a1ed-4869-9bf5-49b46e9a8191.jpg,58500.0
L'Oreal Paris Extraordinary Oil Pink Eclat Imperial,https://images.tokopedia.net/img/cache/200-square/VqbcmM/2023/1/24/fe76f1c1-2f1b-457d-944f-46dd3914d897.jpg,119000.0
Loreal Glycolic Acid Bright Cleanser Foam Glowing Daily Skin Care,https://images.tokopedia.net/img/cache/200-square/VqbcmM/2023/1/3/d9ebbd05-03b9-4b46-8ece-9474aeca314c.jpg,32900.0
Loreal Excellence Fashion Ultra Light 02 Golden Brown - Cat Rambut,https://images.tokopedia.net/img/cache/200-square/VqbcmM/2022/5/4/cfcd794d-1258-4848-a933-b68c7a3827e0.jpg,125800.0
L'oreal Excellence Ash Supreme 6.11 Smoky Ash,https://images.tokopedia.net/img/cache/200-square/VqbcmM/2021/10/26/9ad2e0e6-5b60-496b-a664-dbf49c03baf7.jpg,129000.0
L'oreal inoa pewarna rambut cat rambut no amonia 60ml,https://images.tokopedia.net/img/cache/200-square/VqbcmM/2020/8/27/cbf5ba47-dde5-4ede-a4d4-20bd3786c6ef.jpg,135000.0
L'Oreal Paris Excellence Creme Hair Color Cat Pewarna Rambut Permanen,https://images.tokopedia.net/img/cache/200-square/VqbcmM/2021/10/7/9bfab959-a4af-4b55-ab9b-7353b538de14.jpg,114000.0
L'Oreal Paris Elseve Color Protecting Hair Care Shampoo + Conditioner,https://images.tokopedia.net/img/cache/200-square/VqbcmM/2021/10/20/c86d0ead-bc92-477c-bfb4-25d59d209c02.jpg,52000.0
L'Oreal Elseve Extraordinary Oil Gold Hair Treatment Serum 100 ml,https://images.tokopedia.net/img/cache/200-square/VqbcmM/2022/11/14/59385145-d317-4537-8c0c-b718d1739a55.jpg,91000.0
Loreal excellence hair color cat rambut,https://images.tokopedia.net/img/cache/200-square/VqbcmM/2022/8/11/a1cc12db-af8b-4745-8ec8-33844a0a610d.jpg,99900.0
L'oreal hair color pewarna rambut loreal inoa 3 dark brown plus oxidan,https://images.tokopedia.net/img/cache/200-square/VqbcmM/2020/7/10/66677a39-9482-4537-8d43-867a1fdea7f0.jpg,165000.0
LOREAL Xtenso Oleoshape Smoothing 125ml Obat Pelurus Rambut Rebonding,https://images.tokopedia.net/img/cache/200-square/product-1/2020/9/30/4860517/4860517_f5574eba-baf0-4802-9671-2986b2c867b4_1000_1000,107226.0
L'Oreal Paris Aura Perfect Whip Facial Foam - Sabun Cuci Muka,https://images.tokopedia.net/img/cache/200-square/VqbcmM/2023/1/24/3eeb3172-5aa2-4c33-8964-051c3f0afebe.jpg,46500.0
Loreal Serie Expert Prokeratin Liss Unlimited Shampoo 300 ml Pelembut,https://images.tokopedia.net/img/cache/200-square/VqbcmM/2022/12/6/c1464380-6489-4a76-932a-9f76029ad8f4.jpg,116000.0
L'oreal diarichesse toning rambut no 3 dark brown + oxidan't L'oreal,https://images.tokopedia.net/img/cache/200-square/VqbcmM/2020/9/7/4b24c5d5-84d1-432f-9789-6ae193c43f8d.jpg,95000.0
L'Oreal Paris Fall Resist 3X Anti Hair-Fall Shampoo 450 ml Twin Pack,https://images.tokopedia.net/img/cache/200-square/VqbcmM/2022/8/18/17d93a51-ea83-4f9a-8a72-5f300c39c890.jpg,131300.0
loreal hairspa deep nourishing creambath 1000ml / L'oreal hair spa DX,https://images.tokopedia.net/img/cache/200-square/VqbcmM/2021/6/24/1e2cc125-1351-4a40-89db-c63f7830704d.jpg,152999.0
L'oreal Extraordinary Oil Shampoo Sleek 440ml,https://images.tokopedia.net/img/cache/200-square/VqbcmM/2021/10/7/cf2f7242-4084-45df-bf63-e6d0c077e658.jpg,171900.0
Loreal majifashion 12.11 BUE COAL / ASH GREY ABU ABU SILVER Hair color,https://images.tokopedia.net/img/cache/200-square/VqbcmM/2022/3/16/33f39805-450d-4ecd-a907-848e5e90307f.jpg,99945.0
L'Oreal Paris Total Repair 5 Hair Mask,https://images.tokopedia.net/img/cache/200-square/VqbcmM/2022/8/18/80314c05-3c17-4dd1-b9f9-ad23687982c8.jpg,72000.0
Loreal Serie Expert Silver Shampoo + Cream Conditioner,https://images.tokopedia.net/img/cache/200-square/VqbcmM/2022/1/27/7586a96a-2b1b-4555-b12c-31cac27734a2.jpg,282900.0
Loreal Paris Excellence Creme Hair Color Cat Pewarna Rambut PermanenLo,https://images.tokopedia.net/img/cache/200-square/VqbcmM/2022/8/29/09c9db5c-177b-4e99-9325-2eda814ecdee.jpg,115000.0
Loreal Paris Elseve Extraordinary Oil Gold / Pink 100ml / 100 ml,https://images.tokopedia.net/img/cache/200-square/VqbcmM/2022/3/20/a314bbed-e194-4856-a491-b9740b9236f9.jpg,90999.0
L'Oreal Paris Aura Perfect Whip Facial Foam Twinpack,https://images.tokopedia.net/img/cache/200-square/VqbcmM/2023/1/24/bd13d81a-a149-40f2-8790-a658d38741fc.jpg,80600.0
Loreal Diarechese 2.10 blue black / pewarna rambut / Toning rambut,https://images.tokopedia.net/img/cache/200-square/VqbcmM/2021/4/24/0bf98bc4-6936-433f-8d28-2691eccf416a.jpg,100000.0
Loreal INOA,https://images.tokopedia.net/img/cache/200-square/product-1/2018/5/13/1876848/1876848_6c875c82-d129-4537-9532-d92ba1598358_800_800.jpg,115000.0
Loreal Serie Expert Shampo Resveratrol Vitamino Color Shampoo 300ml,https://images.tokopedia.net/img/cache/200-square/VqbcmM/2022/6/14/eeadff9e-2ebe-4891-82fb-6521cdea6cde.jpg,115999.0
L'OREAL Excellence Fashion - Matt Ash 7.17,https://images.tokopedia.net/img/cache/200-square/VqbcmM/2023/1/12/ff6809f3-d67b-41ce-832b-cb060261004a.jpg,126900.0
silver shampo loreal,https://images.tokopedia.net/img/cache/200-square/VqbcmM/2022/4/17/05674053-9a41-42f8-8a4b-d87eaa154b29.jpg,59999.0
L'Oreal Paris Revitalift Hyaluronic Acid Day Cream,https://images.tokopedia.net/img/cache/200-square/VqbcmM/2022/8/18/e407f4d9-783c-4107-a3b2-25bf75ce8f09.jpg,84800.0
Loreal Excellence Ultra Light Golden Brown No.02/Pewarna Rambut/Hair C,https://images.tokopedia.net/img/cache/200-square/VqbcmM/2022/4/1/2ef77483-0e87-4de0-bc44-fbcb79581d6b.jpg,129000.0
L'Oreal Paris Extraordinary Oil Premium SPECIAL Package - Smooth,https://images.tokopedia.net/img/cache/200-square/VqbcmM/2023/1/5/8b8c51f8-e3ab-4150-aa8e-b094f892b247.jpg,279500.0
loreal hair color ( toning loreal diarichese 50ml 4.20 burgundy,https://images.tokopedia.net/img/cache/200-square/VqbcmM/2022/8/2/cf7ea2a7-3038-4965-b22f-f3207f9927f2.jpg,95000.0
Loreal Expert Absolut Repair Gold Shampoo 1500ml,https://images.tokopedia.net/img/cache/200-square/VqbcmM/2022/6/4/9a1d4610-4602-4a61-ae61-88a735766114.jpg,340000.0
L'Oreal Paris Glycolic Acid Day Cream,https://images.tokopedia.net/img/cache/200-square/VqbcmM/2022/8/18/2ba98db5-3d32-40cf-82ac-5825f3f358c4.jpg,68400.0
Loreal Paris Revitalift Moisturizing Day Night Cream 50ml,https://images.tokopedia.net/img/cache/200-square/VqbcmM/2022/8/31/818f6c42-1e96-46bc-841f-bce70beff79c.jpg,135000.0
LOREAL SERIE EXPERT RESVERATROL VITAMINO COLOR SHAMPOO 1500,https://images.tokopedia.net/img/cache/200-square/VqbcmM/2022/6/6/c34f3f9b-1ab1-499d-b305-65e161a2d286.jpg,340000.0
Loreal Xtenso Smoothing Pelurus Rambut 125ml,https://images.tokopedia.net/img/cache/200-square/product-1/2020/2/20/6232232/6232232_49055070-1827-44dc-9b5e-949be6e7ed9c_486_486.jpg,103950.0
SHAMPO LOREAL ELSEVE PARIS 280ml,https://images.tokopedia.net/img/cache/200-square/VqbcmM/2022/4/13/53f036cb-5941-4d35-9abd-96d3b882734d.jpg,26000.0
LOREAL Oxydant Creme 6%/20vol Cream Developer 1000ml,https://images.tokopedia.net/img/cache/200-square/VqbcmM/2021/11/26/59be7ef4-d8a8-4caa-9a6d-f3e5816fe9f7.png,126000.0
Loreal Paris Revitalift Triple Action Day Night Cream 50ml,https://images.tokopedia.net/img/cache/200-square/VqbcmM/2022/8/31/84683c34-8e94-4269-9529-7f751bf03f6f.jpg,190000.0
L'Oreal Excellence Hair Color Ash Mahogany Brown 4.15,https://images.tokopedia.net/img/cache/200-square/VqbcmM/2021/8/6/27a3daec-1888-4210-aaf5-d675485dfeb0.jpg,115900.0
Loreal Majirel 5.35 Light Golden mahogany brown / pewarna rambut,https://images.tokopedia.net/img/cache/200-square/VqbcmM/2021/4/27/1ffed5ec-eb3b-4c58-b53e-da9d281508ae.jpg,100000.0
